username,body,upVotes,cleaned,tokens,stopwordremove,lemmatized,clean_text
bb0110,"The switch 2 is pretty much what I wanted out of my switch 1. The changes and refinements aren’t huge, but took what was a good console to a great console. From here it is just waiting for more good 1st party titles to keep coming out!",16,the switch 2 is pretty much what i wanted out of my switch 1 the changes and refinements arent huge but took what was a good console to a great console from here it is just waiting for more good 1st party titles to keep coming out,"['the', 'switch', '2', 'is', 'pretty', 'much', 'what', 'i', 'wanted', 'out', 'of', 'my', 'switch', '1', 'the', 'changes', 'and', 'refinements', 'arent', 'huge', 'but', 'took', 'what', 'was', 'a', 'good', 'console', 'to', 'a', 'great', 'console', 'from', 'here', 'it', 'is', 'just', 'waiting', 'for', 'more', 'good', '1st', 'party', 'titles', 'to', 'keep', 'coming', 'out']","['switch', '2', 'pretty', 'much', 'wanted', 'switch', '1', 'changes', 'refinements', 'arent', 'huge', 'took', 'good', 'console', 'great', 'console', 'waiting', 'good', '1st', 'party', 'titles', 'keep', 'coming']","['switch', '2', 'pretty', 'much', 'want', 'switch', '1', 'change', 'refinement', 'arent', 'huge', 'take', 'good', 'console', 'great', 'console', 'wait', 'good', '1st', 'party', 'title', 'keep', 'come']",switch 2 pretty much want switch 1 change refinement arent huge take good console great console wait good 1st party title keep come
youresilent,Agree!,1,agree,['agree'],['agree'],['agree'],agree
Deceptiveideas,"Highly recommend picking up the AmFilm Glass Screen Protector. You can get the 3 pack for $5 after coupon. This will help prevent future scratches.

Dunno which brand you bought but don’t overpay for a screen protector.",7,"highly recommend picking up the amfilm glass screen protector you can get the 3 pack for 5 after coupon this will help prevent future scratches

dunno which brand you bought but dont overpay for a screen protector","['highly', 'recommend', 'picking', 'up', 'the', 'amfilm', 'glass', 'screen', 'protector', 'you', 'can', 'get', 'the', '3', 'pack', 'for', '5', 'after', 'coupon', 'this', 'will', 'help', 'prevent', 'future', 'scratches', 'dunno', 'which', 'brand', 'you', 'bought', 'but', 'dont', 'overpay', 'for', 'a', 'screen', 'protector']","['highly', 'recommend', 'picking', 'amfilm', 'glass', 'screen', 'protector', 'get', '3', 'pack', '5', 'coupon', 'help', 'prevent', 'future', 'scratches', 'dunno', 'brand', 'bought', 'dont', 'overpay', 'screen', 'protector']","['highly', 'recommend', 'pick', 'amfilm', 'glass', 'screen', 'protector', 'get', '3', 'pack', '5', 'coupon', 'help', 'prevent', 'future', 'scratch', 'dunno', 'brand', 'buy', 'dont', 'overpay', 'screen', 'protector']",highly recommend pick amfilm glass screen protector get 3 pack 5 coupon help prevent future scratch dunno brand buy dont overpay screen protector
drhomelessguy,Where at?,2,where at,"['where', 'at']",[],[],
Deceptiveideas,"These are the codes for the Amazon products.

3-Pack Tempered Glass Screen Protectors ($4.95 - Apply promotion code IMMYONIC)

2-Pack Tempered Glass Screen Protector (Matte Finish) ($6.49 - Apply promotion code Z5J4OS2X)

2-Pack amFilm Auto-Alignment OneTouch Screen Protector (Matte Finish)  ($7.52 - Apply promotion code RGBRQ8AL)",4,"these are the codes for the amazon products

3pack tempered glass screen protectors 495  apply promotion code immyonic

2pack tempered glass screen protector matte finish 649  apply promotion code z5j4os2x

2pack amfilm autoalignment onetouch screen protector matte finish  752  apply promotion code rgbrq8al","['these', 'are', 'the', 'codes', 'for', 'the', 'amazon', 'products', '3pack', 'tempered', 'glass', 'screen', 'protectors', '495', 'apply', 'promotion', 'code', 'immyonic', '2pack', 'tempered', 'glass', 'screen', 'protector', 'matte', 'finish', '649', 'apply', 'promotion', 'code', 'z5j4os2x', '2pack', 'amfilm', 'autoalignment', 'onetouch', 'screen', 'protector', 'matte', 'finish', '752', 'apply', 'promotion', 'code', 'rgbrq8al']","['codes', 'amazon', 'products', '3pack', 'tempered', 'glass', 'screen', 'protectors', '495', 'apply', 'promotion', 'code', 'immyonic', '2pack', 'tempered', 'glass', 'screen', 'protector', 'matte', 'finish', '649', 'apply', 'promotion', 'code', 'z5j4os2x', '2pack', 'amfilm', 'autoalignment', 'onetouch', 'screen', 'protector', 'matte', 'finish', '752', 'apply', 'promotion', 'code', 'rgbrq8al']","['code', 'amazon', 'product', '3pack', 'tempered', 'glass', 'screen', 'protector', '495', 'apply', 'promotion', 'code', 'immyonic', '2pack', 'tempered', 'glass', 'screen', 'protector', 'matte', 'finish', '649', 'apply', 'promotion', 'code', 'z5j4os2x', '2pack', 'amfilm', 'autoalignment', 'onetouch', 'screen', 'protector', 'matte', 'finish', '752', 'apply', 'promotion', 'code', 'rgbrq8al']",code amazon product 3pack tempered glass screen protector 495 apply promotion code immyonic 2pack tempered glass screen protector matte finish 649 apply promotion code z5j4os2x 2pack amfilm autoalignment onetouch screen protector matte finish 752 apply promotion code rgbrq8al
drhomelessguy,Many thanks!,1,many thanks,"['many', 'thanks']","['many', 'thanks']","['many', 'thanks']",many thanks
Deceptiveideas,"I just double checked and I bought the one for $8. It comes with a tray you place over the switch and press down to get the screen protector aligned perfectly the first time.

The $5 one is your typical screen protector where you need to use your hands to align the protector with the screen.",2,"i just double checked and i bought the one for 8 it comes with a tray you place over the switch and press down to get the screen protector aligned perfectly the first time

the 5 one is your typical screen protector where you need to use your hands to align the protector with the screen","['i', 'just', 'double', 'checked', 'and', 'i', 'bought', 'the', 'one', 'for', '8', 'it', 'comes', 'with', 'a', 'tray', 'you', 'place', 'over', 'the', 'switch', 'and', 'press', 'down', 'to', 'get', 'the', 'screen', 'protector', 'aligned', 'perfectly', 'the', 'first', 'time', 'the', '5', 'one', 'is', 'your', 'typical', 'screen', 'protector', 'where', 'you', 'need', 'to', 'use', 'your', 'hands', 'to', 'align', 'the', 'protector', 'with', 'the', 'screen']","['double', 'checked', 'bought', 'one', '8', 'comes', 'tray', 'place', 'switch', 'press', 'get', 'screen', 'protector', 'aligned', 'perfectly', 'first', 'time', '5', 'one', 'typical', 'screen', 'protector', 'need', 'use', 'hands', 'align', 'protector', 'screen']","['double', 'check', 'buy', 'one', '8', 'come', 'tray', 'place', 'switch', 'press', 'get', 'screen', 'protector', 'align', 'perfectly', 'first', 'time', '5', 'one', 'typical', 'screen', 'protector', 'need', 'use', 'hand', 'align', 'protector', 'screen']",double check buy one 8 come tray place switch press get screen protector align perfectly first time 5 one typical screen protector need use hand align protector screen
shortandpainful,I bought the 3-pack and it came with an alignment tray. Maybe it was a different listing.,1,i bought the 3pack and it came with an alignment tray maybe it was a different listing,"['i', 'bought', 'the', '3pack', 'and', 'it', 'came', 'with', 'an', 'alignment', 'tray', 'maybe', 'it', 'was', 'a', 'different', 'listing']","['bought', '3pack', 'came', 'alignment', 'tray', 'maybe', 'different', 'listing']","['buy', '3pack', 'come', 'alignment', 'tray', 'maybe', 'different', 'listing']",buy 3pack come alignment tray maybe different listing
Deceptiveideas,"Are you talking about the rectangle plastic panel? That’s not the premium one touch tray. 

The one touch tray is when you literally plop your switch down and just tap to have it be applied for you.

Though if it did come with the one touch tray then you could be right, a different listing.",1,"are you talking about the rectangle plastic panel thats not the premium one touch tray 

the one touch tray is when you literally plop your switch down and just tap to have it be applied for you

though if it did come with the one touch tray then you could be right a different listing","['are', 'you', 'talking', 'about', 'the', 'rectangle', 'plastic', 'panel', 'thats', 'not', 'the', 'premium', 'one', 'touch', 'tray', 'the', 'one', 'touch', 'tray', 'is', 'when', 'you', 'literally', 'plop', 'your', 'switch', 'down', 'and', 'just', 'tap', 'to', 'have', 'it', 'be', 'applied', 'for', 'you', 'though', 'if', 'it', 'did', 'come', 'with', 'the', 'one', 'touch', 'tray', 'then', 'you', 'could', 'be', 'right', 'a', 'different', 'listing']","['talking', 'rectangle', 'plastic', 'panel', 'thats', 'premium', 'one', 'touch', 'tray', 'one', 'touch', 'tray', 'literally', 'plop', 'switch', 'tap', 'applied', 'though', 'come', 'one', 'touch', 'tray', 'could', 'right', 'different', 'listing']","['talk', 'rectangle', 'plastic', 'panel', 'thats', 'premium', 'one', 'touch', 'tray', 'one', 'touch', 'tray', 'literally', 'plop', 'switch', 'tap', 'apply', 'though', 'come', 'one', 'touch', 'tray', 'could', 'right', 'different', 'listing']",talk rectangle plastic panel thats premium one touch tray one touch tray literally plop switch tap apply though come one touch tray could right different listing
shortandpainful,"No, not the one touch tray, but you also don’t need to align it by hand. Mine was aligned perfectly the first time.",1,no not the one touch tray but you also dont need to align it by hand mine was aligned perfectly the first time,"['no', 'not', 'the', 'one', 'touch', 'tray', 'but', 'you', 'also', 'dont', 'need', 'to', 'align', 'it', 'by', 'hand', 'mine', 'was', 'aligned', 'perfectly', 'the', 'first', 'time']","['one', 'touch', 'tray', 'also', 'dont', 'need', 'align', 'hand', 'mine', 'aligned', 'perfectly', 'first', 'time']","['one', 'touch', 'tray', 'also', 'dont', 'need', 'align', 'hand', 'mine', 'align', 'perfectly', 'first', 'time']",one touch tray also dont need align hand mine align perfectly first time
Deceptiveideas,"My problem with those panels is sometimes the screen protector will shift while inside the panel, causing them to be slightly off center. Or they pick up dust/bubbles while you’re aligning the protector inside the panel.",2,my problem with those panels is sometimes the screen protector will shift while inside the panel causing them to be slightly off center or they pick up dustbubbles while youre aligning the protector inside the panel,"['my', 'problem', 'with', 'those', 'panels', 'is', 'sometimes', 'the', 'screen', 'protector', 'will', 'shift', 'while', 'inside', 'the', 'panel', 'causing', 'them', 'to', 'be', 'slightly', 'off', 'center', 'or', 'they', 'pick', 'up', 'dustbubbles', 'while', 'youre', 'aligning', 'the', 'protector', 'inside', 'the', 'panel']","['problem', 'panels', 'sometimes', 'screen', 'protector', 'shift', 'inside', 'panel', 'causing', 'slightly', 'center', 'pick', 'dustbubbles', 'youre', 'aligning', 'protector', 'inside', 'panel']","['problem', 'panel', 'sometimes', 'screen', 'protector', 'shift', 'inside', 'panel', 'cause', 'slightly', 'center', 'pick', 'dustbubbles', 'youre', 'align', 'protector', 'inside', 'panel']",problem panel sometimes screen protector shift inside panel cause slightly center pick dustbubbles youre align protector inside panel
shortandpainful,"Makes sense, I just wanted to clarify that it does come with an aligner and not just the protectors.",1,makes sense i just wanted to clarify that it does come with an aligner and not just the protectors,"['makes', 'sense', 'i', 'just', 'wanted', 'to', 'clarify', 'that', 'it', 'does', 'come', 'with', 'an', 'aligner', 'and', 'not', 'just', 'the', 'protectors']","['makes', 'sense', 'wanted', 'clarify', 'come', 'aligner', 'protectors']","['make', 'sense', 'want', 'clarify', 'come', 'aligner', 'protector']",make sense want clarify come aligner protector
Well_Is_It_Then,Throwing in my 2c to say that Amfilm is amazing. Love that it comes with two in case you mess it up and the tray to help align it is great.,1,throwing in my 2c to say that amfilm is amazing love that it comes with two in case you mess it up and the tray to help align it is great,"['throwing', 'in', 'my', '2c', 'to', 'say', 'that', 'amfilm', 'is', 'amazing', 'love', 'that', 'it', 'comes', 'with', 'two', 'in', 'case', 'you', 'mess', 'it', 'up', 'and', 'the', 'tray', 'to', 'help', 'align', 'it', 'is', 'great']","['throwing', '2c', 'say', 'amfilm', 'amazing', 'love', 'comes', 'two', 'case', 'mess', 'tray', 'help', 'align', 'great']","['throw', '2c', 'say', 'amfilm', 'amazing', 'love', 'come', 'two', 'case', 'mess', 'tray', 'help', 'align', 'great']",throw 2c say amfilm amazing love come two case mess tray help align great
bb0110,Does it mute the crispness and colors a little?,0,does it mute the crispness and colors a little,"['does', 'it', 'mute', 'the', 'crispness', 'and', 'colors', 'a', 'little']","['mute', 'crispness', 'colors', 'little']","['mute', 'crispness', 'color', 'little']",mute crispness color little
OisBlue,Not at all and super easy to install,3,not at all and super easy to install,"['not', 'at', 'all', 'and', 'super', 'easy', 'to', 'install']","['super', 'easy', 'install']","['super', 'easy', 'install']",super easy install
Deceptiveideas,"The regular “gloss” one doesn’t seem to affect visuals at all.

The “matte” anti-reflective screen protectors can make colors appear duller, but that’s the trade off you make when switching from glossy to anti-reflective. Some people might argue being able to see in sunlight is much better tradeoff than a minor downgrade in colors.",4,"the regular gloss one doesnt seem to affect visuals at all

the matte antireflective screen protectors can make colors appear duller but thats the trade off you make when switching from glossy to antireflective some people might argue being able to see in sunlight is much better tradeoff than a minor downgrade in colors","['the', 'regular', 'gloss', 'one', 'doesnt', 'seem', 'to', 'affect', 'visuals', 'at', 'all', 'the', 'matte', 'antireflective', 'screen', 'protectors', 'can', 'make', 'colors', 'appear', 'duller', 'but', 'thats', 'the', 'trade', 'off', 'you', 'make', 'when', 'switching', 'from', 'glossy', 'to', 'antireflective', 'some', 'people', 'might', 'argue', 'being', 'able', 'to', 'see', 'in', 'sunlight', 'is', 'much', 'better', 'tradeoff', 'than', 'a', 'minor', 'downgrade', 'in', 'colors']","['regular', 'gloss', 'one', 'doesnt', 'seem', 'affect', 'visuals', 'matte', 'antireflective', 'screen', 'protectors', 'make', 'colors', 'appear', 'duller', 'thats', 'trade', 'make', 'switching', 'glossy', 'antireflective', 'people', 'might', 'argue', 'able', 'see', 'sunlight', 'much', 'better', 'tradeoff', 'minor', 'downgrade', 'colors']","['regular', 'gloss', 'one', 'doesnt', 'seem', 'affect', 'visuals', 'matte', 'antireflective', 'screen', 'protector', 'make', 'color', 'appear', 'duller', 'thats', 'trade', 'make', 'switch', 'glossy', 'antireflective', 'people', 'might', 'argue', 'able', 'see', 'sunlight', 'much', 'good', 'tradeoff', 'minor', 'downgrade', 'color']",regular gloss one doesnt seem affect visuals matte antireflective screen protector make color appear duller thats trade make switch glossy antireflective people might argue able see sunlight much good tradeoff minor downgrade color
Ninja--Vanish,Just unboxed my Switch 2 today and the first thing I did was put on that AmFilm screen protector. I bought the auto alignment one touch version and it went on perfect.,7,just unboxed my switch 2 today and the first thing i did was put on that amfilm screen protector i bought the auto alignment one touch version and it went on perfect,"['just', 'unboxed', 'my', 'switch', '2', 'today', 'and', 'the', 'first', 'thing', 'i', 'did', 'was', 'put', 'on', 'that', 'amfilm', 'screen', 'protector', 'i', 'bought', 'the', 'auto', 'alignment', 'one', 'touch', 'version', 'and', 'it', 'went', 'on', 'perfect']","['unboxed', 'switch', '2', 'today', 'first', 'thing', 'put', 'amfilm', 'screen', 'protector', 'bought', 'auto', 'alignment', 'one', 'touch', 'version', 'went', 'perfect']","['unboxed', 'switch', '2', 'today', 'first', 'thing', 'put', 'amfilm', 'screen', 'protector', 'buy', 'auto', 'alignment', 'one', 'touch', 'version', 'go', 'perfect']",unboxed switch 2 today first thing put amfilm screen protector buy auto alignment one touch version go perfect
NyquillusDillwad20,"Same. Most of the recent reviews on Amazon for it are bad, so I was hesitant. I'm thinking it may just be review bombs from other Chinese companies so they can steal some sales. Mine went on perfectly and it is crystal clear. Touch works perfectly too.",5,same most of the recent reviews on amazon for it are bad so i was hesitant im thinking it may just be review bombs from other chinese companies so they can steal some sales mine went on perfectly and it is crystal clear touch works perfectly too,"['same', 'most', 'of', 'the', 'recent', 'reviews', 'on', 'amazon', 'for', 'it', 'are', 'bad', 'so', 'i', 'was', 'hesitant', 'im', 'thinking', 'it', 'may', 'just', 'be', 'review', 'bombs', 'from', 'other', 'chinese', 'companies', 'so', 'they', 'can', 'steal', 'some', 'sales', 'mine', 'went', 'on', 'perfectly', 'and', 'it', 'is', 'crystal', 'clear', 'touch', 'works', 'perfectly', 'too']","['recent', 'reviews', 'amazon', 'bad', 'hesitant', 'im', 'thinking', 'may', 'review', 'bombs', 'chinese', 'companies', 'steal', 'sales', 'mine', 'went', 'perfectly', 'crystal', 'clear', 'touch', 'works', 'perfectly']","['recent', 'review', 'amazon', 'bad', 'hesitant', 'im', 'thinking', 'may', 'review', 'bomb', 'chinese', 'company', 'steal', 'sale', 'mine', 'go', 'perfectly', 'crystal', 'clear', 'touch', 'work', 'perfectly']",recent review amazon bad hesitant im thinking may review bomb chinese company steal sale mine go perfectly crystal clear touch work perfectly
Deceptiveideas,"I just checked the reviews because I got curious. Looks like all AmFilm’s screen protectors get lumped together as you can see reviews for the Switch 1 screen protector. 

Reading through the reviews, the switch 1 protectors have a recent manufacturing defect going on where they’re placing the microphone cut upside down. 

There’s also a lot of reviews of people not installing the protector correctly (bubbles) so they left a negative review lol",3,"i just checked the reviews because i got curious looks like all amfilms screen protectors get lumped together as you can see reviews for the switch 1 screen protector 

reading through the reviews the switch 1 protectors have a recent manufacturing defect going on where theyre placing the microphone cut upside down 

theres also a lot of reviews of people not installing the protector correctly bubbles so they left a negative review lol","['i', 'just', 'checked', 'the', 'reviews', 'because', 'i', 'got', 'curious', 'looks', 'like', 'all', 'amfilms', 'screen', 'protectors', 'get', 'lumped', 'together', 'as', 'you', 'can', 'see', 'reviews', 'for', 'the', 'switch', '1', 'screen', 'protector', 'reading', 'through', 'the', 'reviews', 'the', 'switch', '1', 'protectors', 'have', 'a', 'recent', 'manufacturing', 'defect', 'going', 'on', 'where', 'theyre', 'placing', 'the', 'microphone', 'cut', 'upside', 'down', 'theres', 'also', 'a', 'lot', 'of', 'reviews', 'of', 'people', 'not', 'installing', 'the', 'protector', 'correctly', 'bubbles', 'so', 'they', 'left', 'a', 'negative', 'review', 'lol']","['checked', 'reviews', 'got', 'curious', 'looks', 'like', 'amfilms', 'screen', 'protectors', 'get', 'lumped', 'together', 'see', 'reviews', 'switch', '1', 'screen', 'protector', 'reading', 'reviews', 'switch', '1', 'protectors', 'recent', 'manufacturing', 'defect', 'going', 'theyre', 'placing', 'microphone', 'cut', 'upside', 'theres', 'also', 'lot', 'reviews', 'people', 'installing', 'protector', 'correctly', 'bubbles', 'left', 'negative', 'review', 'lol']","['checked', 'review', 'get', 'curious', 'look', 'like', 'amfilms', 'screen', 'protector', 'get', 'lump', 'together', 'see', 'review', 'switch', '1', 'screen', 'protector', 'read', 'review', 'switch', '1', 'protector', 'recent', 'manufacture', 'defect', 'go', 'theyre', 'place', 'microphone', 'cut', 'upside', 'there', 'also', 'lot', 'review', 'people', 'instal', 'protector', 'correctly', 'bubble', 'left', 'negative', 'review', 'lol']",checked review get curious look like amfilms screen protector get lump together see review switch 1 screen protector read review switch 1 protector recent manufacture defect go theyre place microphone cut upside there also lot review people instal protector correctly bubble left negative review lol
NyquillusDillwad20,"Yeah, I sorted by recent to see the Switch 2 reviews from the past few days. A lot of 1-stars.  Some complaining about bubbles (which is baffling given how easy it is to install), others complaining about dust coming on the screen protectors, and some about scratches on the glass. I had none of those issues.",2,yeah i sorted by recent to see the switch 2 reviews from the past few days a lot of 1stars  some complaining about bubbles which is baffling given how easy it is to install others complaining about dust coming on the screen protectors and some about scratches on the glass i had none of those issues,"['yeah', 'i', 'sorted', 'by', 'recent', 'to', 'see', 'the', 'switch', '2', 'reviews', 'from', 'the', 'past', 'few', 'days', 'a', 'lot', 'of', '1stars', 'some', 'complaining', 'about', 'bubbles', 'which', 'is', 'baffling', 'given', 'how', 'easy', 'it', 'is', 'to', 'install', 'others', 'complaining', 'about', 'dust', 'coming', 'on', 'the', 'screen', 'protectors', 'and', 'some', 'about', 'scratches', 'on', 'the', 'glass', 'i', 'had', 'none', 'of', 'those', 'issues']","['yeah', 'sorted', 'recent', 'see', 'switch', '2', 'reviews', 'past', 'days', 'lot', '1stars', 'complaining', 'bubbles', 'baffling', 'given', 'easy', 'install', 'others', 'complaining', 'dust', 'coming', 'screen', 'protectors', 'scratches', 'glass', 'none', 'issues']","['yeah', 'sorted', 'recent', 'see', 'switch', '2', 'review', 'past', 'day', 'lot', '1stars', 'complain', 'bubble', 'baffle', 'give', 'easy', 'install', 'others', 'complain', 'dust', 'come', 'screen', 'protector', 'scratch', 'glass', 'none', 'issue']",yeah sorted recent see switch 2 review past day lot 1stars complain bubble baffle give easy install others complain dust come screen protector scratch glass none issue
[deleted],[removed],2,removed,['removed'],['removed'],['remove'],remove
NintendoSwitch-ModTeam,"Hey there!

Please remember Rule 1 in the future - No personal attacks, trolling, or derogatory terms. Read more about [Reddiquette here](https://reddit.zendesk.com/hc/en-us/articles/205926439-Reddiquette). Thanks!",1,"hey there

please remember rule 1 in the future  no personal attacks trolling or derogatory terms read more about reddiquette herehttpsredditzendeskcomhcenusarticles205926439reddiquette thanks","['hey', 'there', 'please', 'remember', 'rule', '1', 'in', 'the', 'future', 'no', 'personal', 'attacks', 'trolling', 'or', 'derogatory', 'terms', 'read', 'more', 'about', 'reddiquette', 'herehttpsredditzendeskcomhcenusarticles205926439reddiquette', 'thanks']","['hey', 'please', 'remember', 'rule', '1', 'future', 'personal', 'attacks', 'trolling', 'derogatory', 'terms', 'read', 'reddiquette', 'herehttpsredditzendeskcomhcenusarticles205926439reddiquette', 'thanks']","['hey', 'please', 'remember', 'rule', '1', 'future', 'personal', 'attack', 'troll', 'derogatory', 'term', 'read', 'reddiquette', 'herehttpsredditzendeskcomhcenusarticles205926439reddiquette', 'thanks']",hey please remember rule 1 future personal attack troll derogatory term read reddiquette herehttpsredditzendeskcomhcenusarticles205926439reddiquette thanks
