username,body,upVotes,cleaned,tokens,stopwordremove,lemmatized,clean_text
Practical_Rough_7995,Yea i was wondering that to. I mostly want the switch 2 for the older games I have that run like crap. Or just decent but they should run way better ok the switch 2 like ace combat 7 and nier automata etc. Oh and im waiting for ff 7 remake intergrade! I be picking cyberpunk up if I can get my hands on a damn switch 2 eventually. My switch lite is experiencing a slight burn in screen..had it for a hot minute and played the hell outta it. Now with xenoblade chronicles x it overheats slightly when online with max settings brightness etc. ,2,yea i was wondering that to i mostly want the switch 2 for the older games i have that run like crap or just decent but they should run way better ok the switch 2 like ace combat 7 and nier automata etc oh and im waiting for ff 7 remake intergrade i be picking cyberpunk up if i can get my hands on a damn switch 2 eventually my switch lite is experiencing a slight burn in screenhad it for a hot minute and played the hell outta it now with xenoblade chronicles x it overheats slightly when online with max settings brightness etc ,"['yea', 'i', 'was', 'wondering', 'that', 'to', 'i', 'mostly', 'want', 'the', 'switch', '2', 'for', 'the', 'older', 'games', 'i', 'have', 'that', 'run', 'like', 'crap', 'or', 'just', 'decent', 'but', 'they', 'should', 'run', 'way', 'better', 'ok', 'the', 'switch', '2', 'like', 'ace', 'combat', '7', 'and', 'nier', 'automata', 'etc', 'oh', 'and', 'im', 'waiting', 'for', 'ff', '7', 'remake', 'intergrade', 'i', 'be', 'picking', 'cyberpunk', 'up', 'if', 'i', 'can', 'get', 'my', 'hands', 'on', 'a', 'damn', 'switch', '2', 'eventually', 'my', 'switch', 'lite', 'is', 'experiencing', 'a', 'slight', 'burn', 'in', 'screenhad', 'it', 'for', 'a', 'hot', 'minute', 'and', 'played', 'the', 'hell', 'outta', 'it', 'now', 'with', 'xenoblade', 'chronicles', 'x', 'it', 'overheats', 'slightly', 'when', 'online', 'with', 'max', 'settings', 'brightness', 'etc']","['yea', 'wondering', 'mostly', 'want', 'switch', '2', 'older', 'games', 'run', 'like', 'crap', 'decent', 'run', 'way', 'better', 'ok', 'switch', '2', 'like', 'ace', 'combat', '7', 'nier', 'automata', 'etc', 'oh', 'im', 'waiting', 'ff', '7', 'remake', 'intergrade', 'picking', 'cyberpunk', 'get', 'hands', 'damn', 'switch', '2', 'eventually', 'switch', 'lite', 'experiencing', 'slight', 'burn', 'screenhad', 'hot', 'minute', 'played', 'hell', 'outta', 'xenoblade', 'chronicles', 'x', 'overheats', 'slightly', 'online', 'max', 'settings', 'brightness', 'etc']","['yea', 'wonder', 'mostly', 'want', 'switch', '2', 'old', 'game', 'run', 'like', 'crap', 'decent', 'run', 'way', 'well', 'ok', 'switch', '2', 'like', 'ace', 'combat', '7', 'nier', 'automaton', 'etc', 'oh', 'im', 'wait', 'ff', '7', 'remake', 'intergrade', 'pick', 'cyberpunk', 'get', 'hand', 'damn', 'switch', '2', 'eventually', 'switch', 'lite', 'experience', 'slight', 'burn', 'screenhad', 'hot', 'minute', 'play', 'hell', 'outta', 'xenoblade', 'chronicle', 'x', 'overheats', 'slightly', 'online', 'max', 'setting', 'brightness', 'etc']",yea wonder mostly want switch 2 old game run like crap decent run way well ok switch 2 like ace combat 7 nier automaton etc oh im wait ff 7 remake intergrade pick cyberpunk get hand damn switch 2 eventually switch lite experience slight burn screenhad hot minute play hell outta xenoblade chronicle x overheats slightly online max setting brightness etc
Tappxor,Wtf do you mean Donkey Kong is 1080p 30 fps. there's no way that's true,388,wtf do you mean donkey kong is 1080p 30 fps theres no way thats true,"['wtf', 'do', 'you', 'mean', 'donkey', 'kong', 'is', '1080p', '30', 'fps', 'theres', 'no', 'way', 'thats', 'true']","['wtf', 'mean', 'donkey', 'kong', '1080p', '30', 'fps', 'theres', 'way', 'thats', 'true']","['wtf', 'mean', 'donkey', 'kong', '1080p', '30', 'fps', 'there', 'way', 'thats', 'true']",wtf mean donkey kong 1080p 30 fps there way thats true
CreakinFunt,Not to be that guy but that’s not what burn in means,1,not to be that guy but thats not what burn in means,"['not', 'to', 'be', 'that', 'guy', 'but', 'thats', 'not', 'what', 'burn', 'in', 'means']","['guy', 'thats', 'burn', 'means']","['guy', 'thats', 'burn', 'mean']",guy thats burn mean
chrismack32,"Donkey Kong is more than 30fps lol. I played it. There are a few frame drops though, most notably when opening the map or entering a new area. It’s not really a big deal though, doesn’t really affect gameplay",210,donkey kong is more than 30fps lol i played it there are a few frame drops though most notably when opening the map or entering a new area its not really a big deal though doesnt really affect gameplay,"['donkey', 'kong', 'is', 'more', 'than', '30fps', 'lol', 'i', 'played', 'it', 'there', 'are', 'a', 'few', 'frame', 'drops', 'though', 'most', 'notably', 'when', 'opening', 'the', 'map', 'or', 'entering', 'a', 'new', 'area', 'its', 'not', 'really', 'a', 'big', 'deal', 'though', 'doesnt', 'really', 'affect', 'gameplay']","['donkey', 'kong', '30fps', 'lol', 'played', 'frame', 'drops', 'though', 'notably', 'opening', 'map', 'entering', 'new', 'area', 'really', 'big', 'deal', 'though', 'doesnt', 'really', 'affect', 'gameplay']","['donkey', 'kong', '30fps', 'lol', 'play', 'frame', 'drop', 'though', 'notably', 'open', 'map', 'enter', 'new', 'area', 'really', 'big', 'deal', 'though', 'doesnt', 'really', 'affect', 'gameplay']",donkey kong 30fps lol play frame drop though notably open map enter new area really big deal though doesnt really affect gameplay
[deleted],[removed],46,removed,['removed'],['removed'],['remove'],remove
Total_Engineering_51,"DF speculated that a lot of the assets are animating at 30 FPS. If so, I can definitely see how even with a 60 FPS core, there would still be a bit to of a low performance feel to it all.",17,df speculated that a lot of the assets are animating at 30 fps if so i can definitely see how even with a 60 fps core there would still be a bit to of a low performance feel to it all,"['df', 'speculated', 'that', 'a', 'lot', 'of', 'the', 'assets', 'are', 'animating', 'at', '30', 'fps', 'if', 'so', 'i', 'can', 'definitely', 'see', 'how', 'even', 'with', 'a', '60', 'fps', 'core', 'there', 'would', 'still', 'be', 'a', 'bit', 'to', 'of', 'a', 'low', 'performance', 'feel', 'to', 'it', 'all']","['df', 'speculated', 'lot', 'assets', 'animating', '30', 'fps', 'definitely', 'see', 'even', '60', 'fps', 'core', 'would', 'still', 'bit', 'low', 'performance', 'feel']","['df', 'speculate', 'lot', 'asset', 'animate', '30', 'fps', 'definitely', 'see', 'even', '60', 'fps', 'core', 'would', 'still', 'bite', 'low', 'performance', 'feel']",df speculate lot asset animate 30 fps definitely see even 60 fps core would still bite low performance feel
AchtungCloud,"Sure, but most Nintendo consoles launched worldwide or in North America with a big single player focused game from either the Mario or Zelda franchise.

That’s true for NES, SNES, N64, Wii, Switch, Gameboy, GBA, and arguably DS (SM64 DS version was a launch title). 

The outliers are GameCube, which the big launch title was Luigi’s Mansion, Wii U in which it was from the New SMB franchise, and 3DS which basically had no big launch title.

I guess it’s kinda similar to how Wii launched with Wii Sports, but MKW and the Switch 2 aren’t nearly as groundbreaking and new feeling as the Wii, obviously. Plus, Wii also had Twilight Princess at launch.

Obviously, the sales numbers speak to themselves, so their strategy worked, but it really feels like Donkey Kong Bananza (omg, just got this pun) should’ve been a launch title. That would’ve kinda split the difference of GameCube and Wii launches. Two big games at launch, one being a game best for local multiplayer and the second being a secondary franchise.",2,"sure but most nintendo consoles launched worldwide or in north america with a big single player focused game from either the mario or zelda franchise

thats true for nes snes n64 wii switch gameboy gba and arguably ds sm64 ds version was a launch title 

the outliers are gamecube which the big launch title was luigis mansion wii u in which it was from the new smb franchise and 3ds which basically had no big launch title

i guess its kinda similar to how wii launched with wii sports but mkw and the switch 2 arent nearly as groundbreaking and new feeling as the wii obviously plus wii also had twilight princess at launch

obviously the sales numbers speak to themselves so their strategy worked but it really feels like donkey kong bananza omg just got this pun shouldve been a launch title that wouldve kinda split the difference of gamecube and wii launches two big games at launch one being a game best for local multiplayer and the second being a secondary franchise","['sure', 'but', 'most', 'nintendo', 'consoles', 'launched', 'worldwide', 'or', 'in', 'north', 'america', 'with', 'a', 'big', 'single', 'player', 'focused', 'game', 'from', 'either', 'the', 'mario', 'or', 'zelda', 'franchise', 'thats', 'true', 'for', 'nes', 'snes', 'n64', 'wii', 'switch', 'gameboy', 'gba', 'and', 'arguably', 'ds', 'sm64', 'ds', 'version', 'was', 'a', 'launch', 'title', 'the', 'outliers', 'are', 'gamecube', 'which', 'the', 'big', 'launch', 'title', 'was', 'luigis', 'mansion', 'wii', 'u', 'in', 'which', 'it', 'was', 'from', 'the', 'new', 'smb', 'franchise', 'and', '3ds', 'which', 'basically', 'had', 'no', 'big', 'launch', 'title', 'i', 'guess', 'its', 'kinda', 'similar', 'to', 'how', 'wii', 'launched', 'with', 'wii', 'sports', 'but', 'mkw', 'and', 'the', 'switch', '2', 'arent', 'nearly', 'as', 'groundbreaking', 'and', 'new', 'feeling', 'as', 'the', 'wii', 'obviously', 'plus', 'wii', 'also', 'had', 'twilight', 'princess', 'at', 'launch', 'obviously', 'the', 'sales', 'numbers', 'speak', 'to', 'themselves', 'so', 'their', 'strategy', 'worked', 'but', 'it', 'really', 'feels', 'like', 'donkey', 'kong', 'bananza', 'omg', 'just', 'got', 'this', 'pun', 'shouldve', 'been', 'a', 'launch', 'title', 'that', 'wouldve', 'kinda', 'split', 'the', 'difference', 'of', 'gamecube', 'and', 'wii', 'launches', 'two', 'big', 'games', 'at', 'launch', 'one', 'being', 'a', 'game', 'best', 'for', 'local', 'multiplayer', 'and', 'the', 'second', 'being', 'a', 'secondary', 'franchise']","['sure', 'nintendo', 'consoles', 'launched', 'worldwide', 'north', 'america', 'big', 'single', 'player', 'focused', 'game', 'either', 'mario', 'zelda', 'franchise', 'thats', 'true', 'nes', 'snes', 'n64', 'wii', 'switch', 'gameboy', 'gba', 'arguably', 'ds', 'sm64', 'ds', 'version', 'launch', 'title', 'outliers', 'gamecube', 'big', 'launch', 'title', 'luigis', 'mansion', 'wii', 'u', 'new', 'smb', 'franchise', '3ds', 'basically', 'big', 'launch', 'title', 'guess', 'kinda', 'similar', 'wii', 'launched', 'wii', 'sports', 'mkw', 'switch', '2', 'arent', 'nearly', 'groundbreaking', 'new', 'feeling', 'wii', 'obviously', 'plus', 'wii', 'also', 'twilight', 'princess', 'launch', 'obviously', 'sales', 'numbers', 'speak', 'strategy', 'worked', 'really', 'feels', 'like', 'donkey', 'kong', 'bananza', 'omg', 'got', 'pun', 'shouldve', 'launch', 'title', 'wouldve', 'kinda', 'split', 'difference', 'gamecube', 'wii', 'launches', 'two', 'big', 'games', 'launch', 'one', 'game', 'best', 'local', 'multiplayer', 'second', 'secondary', 'franchise']","['sure', 'nintendo', 'console', 'launch', 'worldwide', 'north', 'america', 'big', 'single', 'player', 'focus', 'game', 'either', 'mario', 'zelda', 'franchise', 'thats', 'true', 'ne', 'snes', 'n64', 'wii', 'switch', 'gameboy', 'gba', 'arguably', 'ds', 'sm64', 'ds', 'version', 'launch', 'title', 'outlier', 'gamecube', 'big', 'launch', 'title', 'luigis', 'mansion', 'wii', 'u', 'new', 'smb', 'franchise', '3d', 'basically', 'big', 'launch', 'title', 'guess', 'kinda', 'similar', 'wii', 'launch', 'wii', 'sport', 'mkw', 'switch', '2', 'arent', 'nearly', 'groundbreaking', 'new', 'feel', 'wii', 'obviously', 'plus', 'wii', 'also', 'twilight', 'princess', 'launch', 'obviously', 'sale', 'number', 'speak', 'strategy', 'work', 'really', 'feel', 'like', 'donkey', 'kong', 'bananza', 'omg', 'get', 'pun', 'shouldve', 'launch', 'title', 'wouldve', 'kinda', 'split', 'difference', 'gamecube', 'wii', 'launch', 'two', 'big', 'game', 'launch', 'one', 'game', 'best', 'local', 'multiplayer', 'second', 'secondary', 'franchise']",sure nintendo console launch worldwide north america big single player focus game either mario zelda franchise thats true ne snes n64 wii switch gameboy gba arguably ds sm64 ds version launch title outlier gamecube big launch title luigis mansion wii u new smb franchise 3d basically big launch title guess kinda similar wii launch wii sport mkw switch 2 arent nearly groundbreaking new feel wii obviously plus wii also twilight princess launch obviously sale number speak strategy work really feel like donkey kong bananza omg get pun shouldve launch title wouldve kinda split difference gamecube wii launch two big game launch one game best local multiplayer second secondary franchise
DropDeadEd86,Kinda like Kirby ya mean?,2,kinda like kirby ya mean,"['kinda', 'like', 'kirby', 'ya', 'mean']","['kinda', 'like', 'kirby', 'ya', 'mean']","['kinda', 'like', 'kirby', 'ya', 'mean']",kinda like kirby ya mean
Feenix77,"Obviously long term it’s fine. But they’re right…

All this launch needed was a counter-weight to Mario Kart.

MKW is the “oh shit pick up and play for 20 min with the kids” super fun launch game.

The counter weight needed to be the game you get lost in. The BOTW/Tears/Odyssey game.

It feels a bit (right now) like it doesn’t have that hard pull to “just play more… gotta play more!”

(Edit to be clear):
I am not unhappy. I am not bitching. I’m making an observation. This is the first console I’ve bought since PSX where I didn’t feel more draw to finish whatever I was doing to “get back into it!”   We’ll get there… :)",2,"obviously long term its fine but theyre right

all this launch needed was a counterweight to mario kart

mkw is the oh shit pick up and play for 20 min with the kids super fun launch game

the counter weight needed to be the game you get lost in the botwtearsodyssey game

it feels a bit right now like it doesnt have that hard pull to just play more gotta play more

edit to be clear
i am not unhappy i am not bitching im making an observation this is the first console ive bought since psx where i didnt feel more draw to finish whatever i was doing to get back into it   well get there ","['obviously', 'long', 'term', 'its', 'fine', 'but', 'theyre', 'right', 'all', 'this', 'launch', 'needed', 'was', 'a', 'counterweight', 'to', 'mario', 'kart', 'mkw', 'is', 'the', 'oh', 'shit', 'pick', 'up', 'and', 'play', 'for', '20', 'min', 'with', 'the', 'kids', 'super', 'fun', 'launch', 'game', 'the', 'counter', 'weight', 'needed', 'to', 'be', 'the', 'game', 'you', 'get', 'lost', 'in', 'the', 'botwtearsodyssey', 'game', 'it', 'feels', 'a', 'bit', 'right', 'now', 'like', 'it', 'doesnt', 'have', 'that', 'hard', 'pull', 'to', 'just', 'play', 'more', 'got', 'ta', 'play', 'more', 'edit', 'to', 'be', 'clear', 'i', 'am', 'not', 'unhappy', 'i', 'am', 'not', 'bitching', 'im', 'making', 'an', 'observation', 'this', 'is', 'the', 'first', 'console', 'ive', 'bought', 'since', 'psx', 'where', 'i', 'didnt', 'feel', 'more', 'draw', 'to', 'finish', 'whatever', 'i', 'was', 'doing', 'to', 'get', 'back', 'into', 'it', 'well', 'get', 'there']","['obviously', 'long', 'term', 'fine', 'theyre', 'right', 'launch', 'needed', 'counterweight', 'mario', 'kart', 'mkw', 'oh', 'shit', 'pick', 'play', '20', 'min', 'kids', 'super', 'fun', 'launch', 'game', 'counter', 'weight', 'needed', 'game', 'get', 'lost', 'botwtearsodyssey', 'game', 'feels', 'bit', 'right', 'like', 'doesnt', 'hard', 'pull', 'play', 'got', 'ta', 'play', 'edit', 'clear', 'unhappy', 'bitching', 'im', 'making', 'observation', 'first', 'console', 'ive', 'bought', 'since', 'psx', 'didnt', 'feel', 'draw', 'finish', 'whatever', 'get', 'back', 'well', 'get']","['obviously', 'long', 'term', 'fine', 'theyre', 'right', 'launch', 'need', 'counterweight', 'mario', 'kart', 'mkw', 'oh', 'shit', 'pick', 'play', '20', 'min', 'kid', 'super', 'fun', 'launch', 'game', 'counter', 'weight', 'need', 'game', 'get', 'lose', 'botwtearsodyssey', 'game', 'feel', 'bit', 'right', 'like', 'doesnt', 'hard', 'pull', 'play', 'get', 'ta', 'play', 'edit', 'clear', 'unhappy', 'bitch', 'im', 'make', 'observation', 'first', 'console', 'ive', 'bought', 'since', 'psx', 'didnt', 'feel', 'draw', 'finish', 'whatever', 'get', 'back', 'well', 'get']",obviously long term fine theyre right launch need counterweight mario kart mkw oh shit pick play 20 min kid super fun launch game counter weight need game get lose botwtearsodyssey game feel bit right like doesnt hard pull play get ta play edit clear unhappy bitch im make observation first console ive bought since psx didnt feel draw finish whatever get back well get
whats-this,"Maybe it can run at 60 fps, but it is not a steady 60 so you definitely notice the drops when there is a lot of destruction going on. When just walking around it performs well.",37,maybe it can run at 60 fps but it is not a steady 60 so you definitely notice the drops when there is a lot of destruction going on when just walking around it performs well,"['maybe', 'it', 'can', 'run', 'at', '60', 'fps', 'but', 'it', 'is', 'not', 'a', 'steady', '60', 'so', 'you', 'definitely', 'notice', 'the', 'drops', 'when', 'there', 'is', 'a', 'lot', 'of', 'destruction', 'going', 'on', 'when', 'just', 'walking', 'around', 'it', 'performs', 'well']","['maybe', 'run', '60', 'fps', 'steady', '60', 'definitely', 'notice', 'drops', 'lot', 'destruction', 'going', 'walking', 'around', 'performs', 'well']","['maybe', 'run', '60', 'fps', 'steady', '60', 'definitely', 'notice', 'drop', 'lot', 'destruction', 'go', 'walk', 'around', 'performs', 'well']",maybe run 60 fps steady 60 definitely notice drop lot destruction go walk around performs well
versace_drunk,"See the word “seemed” seems like they just want to say negative things to gather attention like everyone else.

As another poster ironically said “the so called free thinkers”",11,"see the word seemed seems like they just want to say negative things to gather attention like everyone else

as another poster ironically said the so called free thinkers","['see', 'the', 'word', 'seemed', 'seems', 'like', 'they', 'just', 'want', 'to', 'say', 'negative', 'things', 'to', 'gather', 'attention', 'like', 'everyone', 'else', 'as', 'another', 'poster', 'ironically', 'said', 'the', 'so', 'called', 'free', 'thinkers']","['see', 'word', 'seemed', 'seems', 'like', 'want', 'say', 'negative', 'things', 'gather', 'attention', 'like', 'everyone', 'else', 'another', 'poster', 'ironically', 'said', 'called', 'free', 'thinkers']","['see', 'word', 'seem', 'seem', 'like', 'want', 'say', 'negative', 'thing', 'gather', 'attention', 'like', 'everyone', 'else', 'another', 'poster', 'ironically', 'say', 'call', 'free', 'thinker']",see word seem seem like want say negative thing gather attention like everyone else another poster ironically say call free thinker
Employee_Lanky,We’ve known the launch lineup for months. Just wait to buy the console until something you want to play comes out. The constant outrage over nothing is getting so tiring,5,weve known the launch lineup for months just wait to buy the console until something you want to play comes out the constant outrage over nothing is getting so tiring,"['weve', 'known', 'the', 'launch', 'lineup', 'for', 'months', 'just', 'wait', 'to', 'buy', 'the', 'console', 'until', 'something', 'you', 'want', 'to', 'play', 'comes', 'out', 'the', 'constant', 'outrage', 'over', 'nothing', 'is', 'getting', 'so', 'tiring']","['weve', 'known', 'launch', 'lineup', 'months', 'wait', 'buy', 'console', 'something', 'want', 'play', 'comes', 'constant', 'outrage', 'nothing', 'getting', 'tiring']","['weve', 'know', 'launch', 'lineup', 'month', 'wait', 'buy', 'console', 'something', 'want', 'play', 'come', 'constant', 'outrage', 'nothing', 'get', 'tire']",weve know launch lineup month wait buy console something want play come constant outrage nothing get tire
Feenix77,"Of course. But I think this stance is better suited to someone saying. “Fuck this thing this launch and console suuuuck!”

I think it’s perfectly reasonable to have gotten excited (even knowing what was coming) and still feeling a bit blah about it *today*.  :)

I don’t think the OP (and certainly not myself) are feeling scammed or regretful. Merely noting that it’s been a little less exciting than hoped.",1,"of course but i think this stance is better suited to someone saying fuck this thing this launch and console suuuuck

i think its perfectly reasonable to have gotten excited even knowing what was coming and still feeling a bit blah about it today  

i dont think the op and certainly not myself are feeling scammed or regretful merely noting that its been a little less exciting than hoped","['of', 'course', 'but', 'i', 'think', 'this', 'stance', 'is', 'better', 'suited', 'to', 'someone', 'saying', 'fuck', 'this', 'thing', 'this', 'launch', 'and', 'console', 'suuuuck', 'i', 'think', 'its', 'perfectly', 'reasonable', 'to', 'have', 'gotten', 'excited', 'even', 'knowing', 'what', 'was', 'coming', 'and', 'still', 'feeling', 'a', 'bit', 'blah', 'about', 'it', 'today', 'i', 'dont', 'think', 'the', 'op', 'and', 'certainly', 'not', 'myself', 'are', 'feeling', 'scammed', 'or', 'regretful', 'merely', 'noting', 'that', 'its', 'been', 'a', 'little', 'less', 'exciting', 'than', 'hoped']","['course', 'think', 'stance', 'better', 'suited', 'someone', 'saying', 'fuck', 'thing', 'launch', 'console', 'suuuuck', 'think', 'perfectly', 'reasonable', 'gotten', 'excited', 'even', 'knowing', 'coming', 'still', 'feeling', 'bit', 'blah', 'today', 'dont', 'think', 'op', 'certainly', 'feeling', 'scammed', 'regretful', 'merely', 'noting', 'little', 'less', 'exciting', 'hoped']","['course', 'think', 'stance', 'well', 'suit', 'someone', 'say', 'fuck', 'thing', 'launch', 'console', 'suuuuck', 'think', 'perfectly', 'reasonable', 'gotten', 'excite', 'even', 'know', 'come', 'still', 'feel', 'bit', 'blah', 'today', 'dont', 'think', 'op', 'certainly', 'feel', 'scammed', 'regretful', 'merely', 'note', 'little', 'less', 'exciting', 'hop']",course think stance well suit someone say fuck thing launch console suuuuck think perfectly reasonable gotten excite even know come still feel bit blah today dont think op certainly feel scammed regretful merely note little less exciting hop
NoMoreVillains,I'm a bit confused by your comment that the GC games didn't run well. F-Zero GX ran at a steady 60fps on the GC. Did this version not?,146,im a bit confused by your comment that the gc games didnt run well fzero gx ran at a steady 60fps on the gc did this version not,"['im', 'a', 'bit', 'confused', 'by', 'your', 'comment', 'that', 'the', 'gc', 'games', 'didnt', 'run', 'well', 'fzero', 'gx', 'ran', 'at', 'a', 'steady', '60fps', 'on', 'the', 'gc', 'did', 'this', 'version', 'not']","['im', 'bit', 'confused', 'comment', 'gc', 'games', 'didnt', 'run', 'well', 'fzero', 'gx', 'ran', 'steady', '60fps', 'gc', 'version']","['im', 'bit', 'confused', 'comment', 'gc', 'game', 'didnt', 'run', 'well', 'fzero', 'gx', 'run', 'steady', '60fps', 'gc', 'version']",im bit confused comment gc game didnt run well fzero gx run steady 60fps gc version
SupremelyPerfect,"100% with what Feenix77 said. 

The hardware is excellent, just want more to do on it or to anticipate.",0,"100 with what feenix77 said 

the hardware is excellent just want more to do on it or to anticipate","['100', 'with', 'what', 'feenix77', 'said', 'the', 'hardware', 'is', 'excellent', 'just', 'want', 'more', 'to', 'do', 'on', 'it', 'or', 'to', 'anticipate']","['100', 'feenix77', 'said', 'hardware', 'excellent', 'want', 'anticipate']","['100', 'feenix77', 'say', 'hardware', 'excellent', 'want', 'anticipate']",100 feenix77 say hardware excellent want anticipate
ColonelKillDie,I think it’s a typo that turned ‘both ran well’ in to ‘not ran well’,68,i think its a typo that turned both ran well in to not ran well,"['i', 'think', 'its', 'a', 'typo', 'that', 'turned', 'both', 'ran', 'well', 'in', 'to', 'not', 'ran', 'well']","['think', 'typo', 'turned', 'ran', 'well', 'ran', 'well']","['think', 'typo', 'turn', 'ran', 'well', 'ran', 'well']",think typo turn ran well ran well
