username,body,upVotes,cleaned,tokens,stopwordremove,lemmatized,clean_text
Electronic_Impact,"it's a decent console and i love that there are a lot of good deals already for games. 2,99 for brothers, a game i love is just a must play imo. I bought a couple of second hand switch game that got free upgrades and it runs very well, looks nice but i must admit a different controller for the switch 2 would make it even better. So i bought a 8bit ultimate and it should work after a firmware update.",0,its a decent console and i love that there are a lot of good deals already for games 299 for brothers a game i love is just a must play imo i bought a couple of second hand switch game that got free upgrades and it runs very well looks nice but i must admit a different controller for the switch 2 would make it even better so i bought a 8bit ultimate and it should work after a firmware update,"['its', 'a', 'decent', 'console', 'and', 'i', 'love', 'that', 'there', 'are', 'a', 'lot', 'of', 'good', 'deals', 'already', 'for', 'games', '299', 'for', 'brothers', 'a', 'game', 'i', 'love', 'is', 'just', 'a', 'must', 'play', 'imo', 'i', 'bought', 'a', 'couple', 'of', 'second', 'hand', 'switch', 'game', 'that', 'got', 'free', 'upgrades', 'and', 'it', 'runs', 'very', 'well', 'looks', 'nice', 'but', 'i', 'must', 'admit', 'a', 'different', 'controller', 'for', 'the', 'switch', '2', 'would', 'make', 'it', 'even', 'better', 'so', 'i', 'bought', 'a', '8bit', 'ultimate', 'and', 'it', 'should', 'work', 'after', 'a', 'firmware', 'update']","['decent', 'console', 'love', 'lot', 'good', 'deals', 'already', 'games', '299', 'brothers', 'game', 'love', 'must', 'play', 'imo', 'bought', 'couple', 'second', 'hand', 'switch', 'game', 'got', 'free', 'upgrades', 'runs', 'well', 'looks', 'nice', 'must', 'admit', 'different', 'controller', 'switch', '2', 'would', 'make', 'even', 'better', 'bought', '8bit', 'ultimate', 'work', 'firmware', 'update']","['decent', 'console', 'love', 'lot', 'good', 'deal', 'already', 'game', '299', 'brother', 'game', 'love', 'must', 'play', 'imo', 'bought', 'couple', 'second', 'hand', 'switch', 'game', 'get', 'free', 'upgrade', 'run', 'well', 'looks', 'nice', 'must', 'admit', 'different', 'controller', 'switch', '2', 'would', 'make', 'even', 'good', 'buy', '8bit', 'ultimate', 'work', 'firmware', 'update']",decent console love lot good deal already game 299 brother game love must play imo bought couple second hand switch game get free upgrade run well looks nice must admit different controller switch 2 would make even good buy 8bit ultimate work firmware update
EV_4_life,"Idk man, I feel like it breathed life into many old games by virtue of not being 7 year old hardware. There were a few games that were barely playable on NS1 but run fantastic on NS2.",41,idk man i feel like it breathed life into many old games by virtue of not being 7 year old hardware there were a few games that were barely playable on ns1 but run fantastic on ns2,"['idk', 'man', 'i', 'feel', 'like', 'it', 'breathed', 'life', 'into', 'many', 'old', 'games', 'by', 'virtue', 'of', 'not', 'being', '7', 'year', 'old', 'hardware', 'there', 'were', 'a', 'few', 'games', 'that', 'were', 'barely', 'playable', 'on', 'ns1', 'but', 'run', 'fantastic', 'on', 'ns2']","['idk', 'man', 'feel', 'like', 'breathed', 'life', 'many', 'old', 'games', 'virtue', '7', 'year', 'old', 'hardware', 'games', 'barely', 'playable', 'ns1', 'run', 'fantastic', 'ns2']","['idk', 'man', 'feel', 'like', 'breathe', 'life', 'many', 'old', 'game', 'virtue', '7', 'year', 'old', 'hardware', 'game', 'barely', 'playable', 'ns1', 'run', 'fantastic', 'ns2']",idk man feel like breathe life many old game virtue 7 year old hardware game barely playable ns1 run fantastic ns2
Pandomia,"Makes me hella excited for resolution and frame rate patches that will never release for a ton of the games. T_T

Gimme all Xenoblade upgrades maaaan",6,"makes me hella excited for resolution and frame rate patches that will never release for a ton of the games t_t

gimme all xenoblade upgrades maaaan","['makes', 'me', 'hella', 'excited', 'for', 'resolution', 'and', 'frame', 'rate', 'patches', 'that', 'will', 'never', 'release', 'for', 'a', 'ton', 'of', 'the', 'games', 't_t', 'gim', 'me', 'all', 'xenoblade', 'upgrades', 'maaaan']","['makes', 'hella', 'excited', 'resolution', 'frame', 'rate', 'patches', 'never', 'release', 'ton', 'games', 't_t', 'gim', 'xenoblade', 'upgrades', 'maaaan']","['make', 'hella', 'excited', 'resolution', 'frame', 'rate', 'patch', 'never', 'release', 'ton', 'game', 't_t', 'gim', 'xenoblade', 'upgrade', 'maaaan']",make hella excited resolution frame rate patch never release ton game t_t gim xenoblade upgrade maaaan
SnooStories9827,"I held off on playing TotK and Xenoblade 3 specifically for Switch 2. I'm very happy with TotK running so nice and at 60fps, but holy shit does Xenoblade still look like ass. Hoping for that to get patched (I'd be a sheep and pay for an upgrade if they had one) so it looks better and runs at 60fps.

 I'd love it if the other Xenoblades got that treatment as well but there's no way in hell I would have time to replay Xeno 1, 2,and X haha.",2,"i held off on playing totk and xenoblade 3 specifically for switch 2 im very happy with totk running so nice and at 60fps but holy shit does xenoblade still look like ass hoping for that to get patched id be a sheep and pay for an upgrade if they had one so it looks better and runs at 60fps

 id love it if the other xenoblades got that treatment as well but theres no way in hell i would have time to replay xeno 1 2and x haha","['i', 'held', 'off', 'on', 'playing', 'totk', 'and', 'xenoblade', '3', 'specifically', 'for', 'switch', '2', 'im', 'very', 'happy', 'with', 'totk', 'running', 'so', 'nice', 'and', 'at', '60fps', 'but', 'holy', 'shit', 'does', 'xenoblade', 'still', 'look', 'like', 'ass', 'hoping', 'for', 'that', 'to', 'get', 'patched', 'id', 'be', 'a', 'sheep', 'and', 'pay', 'for', 'an', 'upgrade', 'if', 'they', 'had', 'one', 'so', 'it', 'looks', 'better', 'and', 'runs', 'at', '60fps', 'id', 'love', 'it', 'if', 'the', 'other', 'xenoblades', 'got', 'that', 'treatment', 'as', 'well', 'but', 'theres', 'no', 'way', 'in', 'hell', 'i', 'would', 'have', 'time', 'to', 'replay', 'xeno', '1', '2and', 'x', 'haha']","['held', 'playing', 'totk', 'xenoblade', '3', 'specifically', 'switch', '2', 'im', 'happy', 'totk', 'running', 'nice', '60fps', 'holy', 'shit', 'xenoblade', 'still', 'look', 'like', 'ass', 'hoping', 'get', 'patched', 'id', 'sheep', 'pay', 'upgrade', 'one', 'looks', 'better', 'runs', '60fps', 'id', 'love', 'xenoblades', 'got', 'treatment', 'well', 'theres', 'way', 'hell', 'would', 'time', 'replay', 'xeno', '1', '2and', 'x', 'haha']","['hold', 'play', 'totk', 'xenoblade', '3', 'specifically', 'switch', '2', 'im', 'happy', 'totk', 'run', 'nice', '60fps', 'holy', 'shit', 'xenoblade', 'still', 'look', 'like', 'as', 'hop', 'get', 'patch', 'id', 'sheep', 'pay', 'upgrade', 'one', 'look', 'good', 'run', '60fps', 'id', 'love', 'xenoblades', 'get', 'treatment', 'well', 'theres', 'way', 'hell', 'would', 'time', 'replay', 'xeno', '1', '2and', 'x', 'haha']",hold play totk xenoblade 3 specifically switch 2 im happy totk run nice 60fps holy shit xenoblade still look like as hop get patch id sheep pay upgrade one look good run 60fps id love xenoblades get treatment well theres way hell would time replay xeno 1 2and x haha
AuthoringInProgress,It's worth noting both zeldas get the switch 2 upgrade without additional cost of you're a expansion pass holder.,-1,its worth noting both zeldas get the switch 2 upgrade without additional cost of youre a expansion pass holder,"['its', 'worth', 'noting', 'both', 'zeldas', 'get', 'the', 'switch', '2', 'upgrade', 'without', 'additional', 'cost', 'of', 'youre', 'a', 'expansion', 'pass', 'holder']","['worth', 'noting', 'zeldas', 'get', 'switch', '2', 'upgrade', 'without', 'additional', 'cost', 'youre', 'expansion', 'pass', 'holder']","['worth', 'note', 'zeldas', 'get', 'switch', '2', 'upgrade', 'without', 'additional', 'cost', 'youre', 'expansion', 'pas', 'holder']",worth note zeldas get switch 2 upgrade without additional cost youre expansion pas holder
Wolfwoode,"It breathes new life into the games that don't break on Switch 2.

I was excited to enjoy ""A Hat in Time"" with decent frame rates and I found a game breaking bug blocking my progression.",1,"it breathes new life into the games that dont break on switch 2

i was excited to enjoy a hat in time with decent frame rates and i found a game breaking bug blocking my progression","['it', 'breathes', 'new', 'life', 'into', 'the', 'games', 'that', 'dont', 'break', 'on', 'switch', '2', 'i', 'was', 'excited', 'to', 'enjoy', 'a', 'hat', 'in', 'time', 'with', 'decent', 'frame', 'rates', 'and', 'i', 'found', 'a', 'game', 'breaking', 'bug', 'blocking', 'my', 'progression']","['breathes', 'new', 'life', 'games', 'dont', 'break', 'switch', '2', 'excited', 'enjoy', 'hat', 'time', 'decent', 'frame', 'rates', 'found', 'game', 'breaking', 'bug', 'blocking', 'progression']","['breathes', 'new', 'life', 'game', 'dont', 'break', 'switch', '2', 'excite', 'enjoy', 'hat', 'time', 'decent', 'frame', 'rate', 'find', 'game', 'break', 'bug', 'block', 'progression']",breathes new life game dont break switch 2 excite enjoy hat time decent frame rate find game break bug block progression
AlternativeFruit1337,Maybe Outer Worlds will be playable now,1,maybe outer worlds will be playable now,"['maybe', 'outer', 'worlds', 'will', 'be', 'playable', 'now']","['maybe', 'outer', 'worlds', 'playable']","['maybe', 'outer', 'world', 'playable']",maybe outer world playable
catch22-,"I’m kind of baffled by posts like these.  The library of games at launch was not a secret. It was advertised.   You could’ve just waited till the fall or even next year to buy one, once some games you really want are available.  That is exactly what I’m doing.  Mario kart doesn’t do it for me anymore.",38,im kind of baffled by posts like these  the library of games at launch was not a secret it was advertised   you couldve just waited till the fall or even next year to buy one once some games you really want are available  that is exactly what im doing  mario kart doesnt do it for me anymore,"['im', 'kind', 'of', 'baffled', 'by', 'posts', 'like', 'these', 'the', 'library', 'of', 'games', 'at', 'launch', 'was', 'not', 'a', 'secret', 'it', 'was', 'advertised', 'you', 'couldve', 'just', 'waited', 'till', 'the', 'fall', 'or', 'even', 'next', 'year', 'to', 'buy', 'one', 'once', 'some', 'games', 'you', 'really', 'want', 'are', 'available', 'that', 'is', 'exactly', 'what', 'im', 'doing', 'mario', 'kart', 'doesnt', 'do', 'it', 'for', 'me', 'anymore']","['im', 'kind', 'baffled', 'posts', 'like', 'library', 'games', 'launch', 'secret', 'advertised', 'couldve', 'waited', 'till', 'fall', 'even', 'next', 'year', 'buy', 'one', 'games', 'really', 'want', 'available', 'exactly', 'im', 'mario', 'kart', 'doesnt', 'anymore']","['im', 'kind', 'baffle', 'post', 'like', 'library', 'game', 'launch', 'secret', 'advertise', 'couldve', 'wait', 'till', 'fall', 'even', 'next', 'year', 'buy', 'one', 'game', 'really', 'want', 'available', 'exactly', 'im', 'mario', 'kart', 'doesnt', 'anymore']",im kind baffle post like library game launch secret advertise couldve wait till fall even next year buy one game really want available exactly im mario kart doesnt anymore
linkling1039,"Wish more people had you mentally. I would like to understand why people are treating Switch 2 launch like it was a false advertisement or that Mario Kart is not a big deal to be a launch title.




If you want more options, just wait for the holiday or a game you want launches. ",7,"wish more people had you mentally i would like to understand why people are treating switch 2 launch like it was a false advertisement or that mario kart is not a big deal to be a launch title




if you want more options just wait for the holiday or a game you want launches ","['wish', 'more', 'people', 'had', 'you', 'mentally', 'i', 'would', 'like', 'to', 'understand', 'why', 'people', 'are', 'treating', 'switch', '2', 'launch', 'like', 'it', 'was', 'a', 'false', 'advertisement', 'or', 'that', 'mario', 'kart', 'is', 'not', 'a', 'big', 'deal', 'to', 'be', 'a', 'launch', 'title', 'if', 'you', 'want', 'more', 'options', 'just', 'wait', 'for', 'the', 'holiday', 'or', 'a', 'game', 'you', 'want', 'launches']","['wish', 'people', 'mentally', 'would', 'like', 'understand', 'people', 'treating', 'switch', '2', 'launch', 'like', 'false', 'advertisement', 'mario', 'kart', 'big', 'deal', 'launch', 'title', 'want', 'options', 'wait', 'holiday', 'game', 'want', 'launches']","['wish', 'people', 'mentally', 'would', 'like', 'understand', 'people', 'treat', 'switch', '2', 'launch', 'like', 'false', 'advertisement', 'mario', 'kart', 'big', 'deal', 'launch', 'title', 'want', 'option', 'wait', 'holiday', 'game', 'want', 'launch']",wish people mentally would like understand people treat switch 2 launch like false advertisement mario kart big deal launch title want option wait holiday game want launch
Remy149,I bought mine at launch because I was looking forward to playing switch 1 games I skipped due to performance issues the last few years. I’m currently playing Pokemon violet and links awakening. I’m actually going to start the bravely default remaster when I’m done with links awakening. I’m enjoying the switch 2 launch a lot more then the og switch 1’s,6,i bought mine at launch because i was looking forward to playing switch 1 games i skipped due to performance issues the last few years im currently playing pokemon violet and links awakening im actually going to start the bravely default remaster when im done with links awakening im enjoying the switch 2 launch a lot more then the og switch 1s,"['i', 'bought', 'mine', 'at', 'launch', 'because', 'i', 'was', 'looking', 'forward', 'to', 'playing', 'switch', '1', 'games', 'i', 'skipped', 'due', 'to', 'performance', 'issues', 'the', 'last', 'few', 'years', 'im', 'currently', 'playing', 'pokemon', 'violet', 'and', 'links', 'awakening', 'im', 'actually', 'going', 'to', 'start', 'the', 'bravely', 'default', 'remaster', 'when', 'im', 'done', 'with', 'links', 'awakening', 'im', 'enjoying', 'the', 'switch', '2', 'launch', 'a', 'lot', 'more', 'then', 'the', 'og', 'switch', '1s']","['bought', 'mine', 'launch', 'looking', 'forward', 'playing', 'switch', '1', 'games', 'skipped', 'due', 'performance', 'issues', 'last', 'years', 'im', 'currently', 'playing', 'pokemon', 'violet', 'links', 'awakening', 'im', 'actually', 'going', 'start', 'bravely', 'default', 'remaster', 'im', 'done', 'links', 'awakening', 'im', 'enjoying', 'switch', '2', 'launch', 'lot', 'og', 'switch', '1s']","['buy', 'mine', 'launch', 'look', 'forward', 'play', 'switch', '1', 'game', 'skip', 'due', 'performance', 'issue', 'last', 'year', 'im', 'currently', 'play', 'pokemon', 'violet', 'link', 'awaken', 'im', 'actually', 'go', 'start', 'bravely', 'default', 'remaster', 'im', 'do', 'link', 'awaken', 'im', 'enjoy', 'switch', '2', 'launch', 'lot', 'og', 'switch', '1']",buy mine launch look forward play switch 1 game skip due performance issue last year im currently play pokemon violet link awaken im actually go start bravely default remaster im do link awaken im enjoy switch 2 launch lot og switch 1
catch22-,Yes it definitely helps that the s2 has the whole back catalogue available.  For me tho I’m waiting for Metroid prime 4 as that’s the game I am most excited for.  That plus DK bonanza and cyberpunk might be the trio I need to take the plunge and get the switch 2.  I’m also waiting to see what holiday surprises Nintendo has up their sleeve.,3,yes it definitely helps that the s2 has the whole back catalogue available  for me tho im waiting for metroid prime 4 as thats the game i am most excited for  that plus dk bonanza and cyberpunk might be the trio i need to take the plunge and get the switch 2  im also waiting to see what holiday surprises nintendo has up their sleeve,"['yes', 'it', 'definitely', 'helps', 'that', 'the', 's2', 'has', 'the', 'whole', 'back', 'catalogue', 'available', 'for', 'me', 'tho', 'im', 'waiting', 'for', 'metroid', 'prime', '4', 'as', 'thats', 'the', 'game', 'i', 'am', 'most', 'excited', 'for', 'that', 'plus', 'dk', 'bonanza', 'and', 'cyberpunk', 'might', 'be', 'the', 'trio', 'i', 'need', 'to', 'take', 'the', 'plunge', 'and', 'get', 'the', 'switch', '2', 'im', 'also', 'waiting', 'to', 'see', 'what', 'holiday', 'surprises', 'nintendo', 'has', 'up', 'their', 'sleeve']","['yes', 'definitely', 'helps', 's2', 'whole', 'back', 'catalogue', 'available', 'tho', 'im', 'waiting', 'metroid', 'prime', '4', 'thats', 'game', 'excited', 'plus', 'dk', 'bonanza', 'cyberpunk', 'might', 'trio', 'need', 'take', 'plunge', 'get', 'switch', '2', 'im', 'also', 'waiting', 'see', 'holiday', 'surprises', 'nintendo', 'sleeve']","['yes', 'definitely', 'help', 's2', 'whole', 'back', 'catalogue', 'available', 'tho', 'im', 'wait', 'metroid', 'prime', '4', 'thats', 'game', 'excite', 'plus', 'dk', 'bonanza', 'cyberpunk', 'might', 'trio', 'need', 'take', 'plunge', 'get', 'switch', '2', 'im', 'also', 'wait', 'see', 'holiday', 'surprise', 'nintendo', 'sleeve']",yes definitely help s2 whole back catalogue available tho im wait metroid prime 4 thats game excite plus dk bonanza cyberpunk might trio need take plunge get switch 2 im also wait see holiday surprise nintendo sleeve
Queasy_Watch478,"that's what i'm doing too! though not really by choice lol cause i have to save up lots to buy the console at all... :) BUT i AM also waiting for METROID PRIME 4 and also Pokemon ZA. so i'll probably have enough to buy it in like october/november, and then i can buy those games too at around the same time. hopefully!

oh yeah and of course donkey kong will have been out for a while by then so i can buy that one too. :)",2,"thats what im doing too though not really by choice lol cause i have to save up lots to buy the console at all  but i am also waiting for metroid prime 4 and also pokemon za so ill probably have enough to buy it in like octobernovember and then i can buy those games too at around the same time hopefully

oh yeah and of course donkey kong will have been out for a while by then so i can buy that one too ","['thats', 'what', 'im', 'doing', 'too', 'though', 'not', 'really', 'by', 'choice', 'lol', 'cause', 'i', 'have', 'to', 'save', 'up', 'lots', 'to', 'buy', 'the', 'console', 'at', 'all', 'but', 'i', 'am', 'also', 'waiting', 'for', 'metroid', 'prime', '4', 'and', 'also', 'pokemon', 'za', 'so', 'ill', 'probably', 'have', 'enough', 'to', 'buy', 'it', 'in', 'like', 'octobernovember', 'and', 'then', 'i', 'can', 'buy', 'those', 'games', 'too', 'at', 'around', 'the', 'same', 'time', 'hopefully', 'oh', 'yeah', 'and', 'of', 'course', 'donkey', 'kong', 'will', 'have', 'been', 'out', 'for', 'a', 'while', 'by', 'then', 'so', 'i', 'can', 'buy', 'that', 'one', 'too']","['thats', 'im', 'though', 'really', 'choice', 'lol', 'cause', 'save', 'lots', 'buy', 'console', 'also', 'waiting', 'metroid', 'prime', '4', 'also', 'pokemon', 'za', 'ill', 'probably', 'enough', 'buy', 'like', 'octobernovember', 'buy', 'games', 'around', 'time', 'hopefully', 'oh', 'yeah', 'course', 'donkey', 'kong', 'buy', 'one']","['thats', 'im', 'though', 'really', 'choice', 'lol', 'cause', 'save', 'lot', 'buy', 'console', 'also', 'wait', 'metroid', 'prime', '4', 'also', 'pokemon', 'za', 'ill', 'probably', 'enough', 'buy', 'like', 'octobernovember', 'buy', 'game', 'around', 'time', 'hopefully', 'oh', 'yeah', 'course', 'donkey', 'kong', 'buy', 'one']",thats im though really choice lol cause save lot buy console also wait metroid prime 4 also pokemon za ill probably enough buy like octobernovember buy game around time hopefully oh yeah course donkey kong buy one
nosungdeeptongs,"I'm getting one in a couple weeks, pretty much just go continue playing switch 1 games for the time being. I might actually put together a team to take online in pokemon now that it runs like a real game lol",1,im getting one in a couple weeks pretty much just go continue playing switch 1 games for the time being i might actually put together a team to take online in pokemon now that it runs like a real game lol,"['im', 'getting', 'one', 'in', 'a', 'couple', 'weeks', 'pretty', 'much', 'just', 'go', 'continue', 'playing', 'switch', '1', 'games', 'for', 'the', 'time', 'being', 'i', 'might', 'actually', 'put', 'together', 'a', 'team', 'to', 'take', 'online', 'in', 'pokemon', 'now', 'that', 'it', 'runs', 'like', 'a', 'real', 'game', 'lol']","['im', 'getting', 'one', 'couple', 'weeks', 'pretty', 'much', 'go', 'continue', 'playing', 'switch', '1', 'games', 'time', 'might', 'actually', 'put', 'together', 'team', 'take', 'online', 'pokemon', 'runs', 'like', 'real', 'game', 'lol']","['im', 'get', 'one', 'couple', 'week', 'pretty', 'much', 'go', 'continue', 'play', 'switch', '1', 'game', 'time', 'might', 'actually', 'put', 'together', 'team', 'take', 'online', 'pokemon', 'run', 'like', 'real', 'game', 'lol']",im get one couple week pretty much go continue play switch 1 game time might actually put together team take online pokemon run like real game lol
Bostongamer19,"I expect the lineup to improve by December still. There will be some sort of remake maybe an earthbound or paper Mario or something like that.

In terms of the lineup tho it is still surprising. 

They had a ton of time to prepare and a few years of almost no releases.

Then they release 3 games that appear almost as if they were started for the original switch.

They don’t seem very concerned tho so I’m sure they are cooking some big things next year or the following.",1,"i expect the lineup to improve by december still there will be some sort of remake maybe an earthbound or paper mario or something like that

in terms of the lineup tho it is still surprising 

they had a ton of time to prepare and a few years of almost no releases

then they release 3 games that appear almost as if they were started for the original switch

they dont seem very concerned tho so im sure they are cooking some big things next year or the following","['i', 'expect', 'the', 'lineup', 'to', 'improve', 'by', 'december', 'still', 'there', 'will', 'be', 'some', 'sort', 'of', 'remake', 'maybe', 'an', 'earthbound', 'or', 'paper', 'mario', 'or', 'something', 'like', 'that', 'in', 'terms', 'of', 'the', 'lineup', 'tho', 'it', 'is', 'still', 'surprising', 'they', 'had', 'a', 'ton', 'of', 'time', 'to', 'prepare', 'and', 'a', 'few', 'years', 'of', 'almost', 'no', 'releases', 'then', 'they', 'release', '3', 'games', 'that', 'appear', 'almost', 'as', 'if', 'they', 'were', 'started', 'for', 'the', 'original', 'switch', 'they', 'dont', 'seem', 'very', 'concerned', 'tho', 'so', 'im', 'sure', 'they', 'are', 'cooking', 'some', 'big', 'things', 'next', 'year', 'or', 'the', 'following']","['expect', 'lineup', 'improve', 'december', 'still', 'sort', 'remake', 'maybe', 'earthbound', 'paper', 'mario', 'something', 'like', 'terms', 'lineup', 'tho', 'still', 'surprising', 'ton', 'time', 'prepare', 'years', 'almost', 'releases', 'release', '3', 'games', 'appear', 'almost', 'started', 'original', 'switch', 'dont', 'seem', 'concerned', 'tho', 'im', 'sure', 'cooking', 'big', 'things', 'next', 'year', 'following']","['expect', 'lineup', 'improve', 'december', 'still', 'sort', 'remake', 'maybe', 'earthbound', 'paper', 'mario', 'something', 'like', 'term', 'lineup', 'tho', 'still', 'surprising', 'ton', 'time', 'prepare', 'year', 'almost', 'release', 'release', '3', 'game', 'appear', 'almost', 'start', 'original', 'switch', 'dont', 'seem', 'concern', 'tho', 'im', 'sure', 'cook', 'big', 'thing', 'next', 'year', 'follow']",expect lineup improve december still sort remake maybe earthbound paper mario something like term lineup tho still surprising ton time prepare year almost release release 3 game appear almost start original switch dont seem concern tho im sure cook big thing next year follow
