username,body,upVotes,cleaned,tokens,stopwordremove,lemmatized,clean_text
SupremelyPerfect,"There's nothing baffling about it! I buy every Nintendo console at launch if I have the money. I'm still happy with the purchase just MK didn't entertain as long as I thought. Thought the open world would have more to do tbh.

Think a lot of us hoping for a E3 direct or just more cross platonic games announced at the other conferences/events.",0,"theres nothing baffling about it i buy every nintendo console at launch if i have the money im still happy with the purchase just mk didnt entertain as long as i thought thought the open world would have more to do tbh

think a lot of us hoping for a e3 direct or just more cross platonic games announced at the other conferencesevents","['theres', 'nothing', 'baffling', 'about', 'it', 'i', 'buy', 'every', 'nintendo', 'console', 'at', 'launch', 'if', 'i', 'have', 'the', 'money', 'im', 'still', 'happy', 'with', 'the', 'purchase', 'just', 'mk', 'didnt', 'entertain', 'as', 'long', 'as', 'i', 'thought', 'thought', 'the', 'open', 'world', 'would', 'have', 'more', 'to', 'do', 'tbh', 'think', 'a', 'lot', 'of', 'us', 'hoping', 'for', 'a', 'e3', 'direct', 'or', 'just', 'more', 'cross', 'platonic', 'games', 'announced', 'at', 'the', 'other', 'conferencesevents']","['theres', 'nothing', 'baffling', 'buy', 'every', 'nintendo', 'console', 'launch', 'money', 'im', 'still', 'happy', 'purchase', 'mk', 'didnt', 'entertain', 'long', 'thought', 'thought', 'open', 'world', 'would', 'tbh', 'think', 'lot', 'us', 'hoping', 'e3', 'direct', 'cross', 'platonic', 'games', 'announced', 'conferencesevents']","['there', 'nothing', 'baffle', 'buy', 'every', 'nintendo', 'console', 'launch', 'money', 'im', 'still', 'happy', 'purchase', 'mk', 'didnt', 'entertain', 'long', 'think', 'think', 'open', 'world', 'would', 'tbh', 'think', 'lot', 'u', 'hop', 'e3', 'direct', 'cross', 'platonic', 'game', 'announce', 'conferencesevents']",there nothing baffle buy every nintendo console launch money im still happy purchase mk didnt entertain long think think open world would tbh think lot u hop e3 direct cross platonic game announce conferencesevents
mrdominoe,"First console launch, huh?",65,first console launch huh,"['first', 'console', 'launch', 'huh']","['first', 'console', 'launch', 'huh']","['first', 'console', 'launch', 'huh']",first console launch huh
MolotovMan1263,"Has anyone ever picked up a new console and thought “yea im totally satisfied on day 1, ill never buy another game”?

We buy these as investments in a future library",54,"has anyone ever picked up a new console and thought yea im totally satisfied on day 1 ill never buy another game

we buy these as investments in a future library","['has', 'anyone', 'ever', 'picked', 'up', 'a', 'new', 'console', 'and', 'thought', 'yea', 'im', 'totally', 'satisfied', 'on', 'day', '1', 'ill', 'never', 'buy', 'another', 'game', 'we', 'buy', 'these', 'as', 'investments', 'in', 'a', 'future', 'library']","['anyone', 'ever', 'picked', 'new', 'console', 'thought', 'yea', 'im', 'totally', 'satisfied', 'day', '1', 'ill', 'never', 'buy', 'another', 'game', 'buy', 'investments', 'future', 'library']","['anyone', 'ever', 'pick', 'new', 'console', 'think', 'yea', 'im', 'totally', 'satisfied', 'day', '1', 'ill', 'never', 'buy', 'another', 'game', 'buy', 'investment', 'future', 'library']",anyone ever pick new console think yea im totally satisfied day 1 ill never buy another game buy investment future library
heyf00L,"No, but GameCube I personally bought Rogue Leader, Wave Race, and THPS3. I had friends who got Luigi's Mansion, Crazy Taxi, and Super Monkey Ball; and we'd swap games. Those were all launch games. I would have been happy with those for a long while, but within a month Smash Melee, Pikmin, SSX Tricky, and Extreme-G 3 were out.

On  the other hand I got a launch GBA, and it sucked for a while.",6,"no but gamecube i personally bought rogue leader wave race and thps3 i had friends who got luigis mansion crazy taxi and super monkey ball and wed swap games those were all launch games i would have been happy with those for a long while but within a month smash melee pikmin ssx tricky and extremeg 3 were out

on  the other hand i got a launch gba and it sucked for a while","['no', 'but', 'gamecube', 'i', 'personally', 'bought', 'rogue', 'leader', 'wave', 'race', 'and', 'thps3', 'i', 'had', 'friends', 'who', 'got', 'luigis', 'mansion', 'crazy', 'taxi', 'and', 'super', 'monkey', 'ball', 'and', 'wed', 'swap', 'games', 'those', 'were', 'all', 'launch', 'games', 'i', 'would', 'have', 'been', 'happy', 'with', 'those', 'for', 'a', 'long', 'while', 'but', 'within', 'a', 'month', 'smash', 'melee', 'pikmin', 'ssx', 'tricky', 'and', 'extremeg', '3', 'were', 'out', 'on', 'the', 'other', 'hand', 'i', 'got', 'a', 'launch', 'gba', 'and', 'it', 'sucked', 'for', 'a', 'while']","['gamecube', 'personally', 'bought', 'rogue', 'leader', 'wave', 'race', 'thps3', 'friends', 'got', 'luigis', 'mansion', 'crazy', 'taxi', 'super', 'monkey', 'ball', 'wed', 'swap', 'games', 'launch', 'games', 'would', 'happy', 'long', 'within', 'month', 'smash', 'melee', 'pikmin', 'ssx', 'tricky', 'extremeg', '3', 'hand', 'got', 'launch', 'gba', 'sucked']","['gamecube', 'personally', 'buy', 'rogue', 'leader', 'wave', 'race', 'thps3', 'friend', 'get', 'luigis', 'mansion', 'crazy', 'taxi', 'super', 'monkey', 'ball', 'wed', 'swap', 'game', 'launch', 'game', 'would', 'happy', 'long', 'within', 'month', 'smash', 'melee', 'pikmin', 'ssx', 'tricky', 'extremeg', '3', 'hand', 'get', 'launch', 'gba', 'suck']",gamecube personally buy rogue leader wave race thps3 friend get luigis mansion crazy taxi super monkey ball wed swap game launch game would happy long within month smash melee pikmin ssx tricky extremeg 3 hand get launch gba suck
reevestussi,"Interesting, I thought GBA had a pretty strong launch window especially with THPS2, Mario Advance, Konami Krazy Racers, F-Zero MV, Castlevania: Circle of the Moon and Chu Chu Rocket",1,interesting i thought gba had a pretty strong launch window especially with thps2 mario advance konami krazy racers fzero mv castlevania circle of the moon and chu chu rocket,"['interesting', 'i', 'thought', 'gba', 'had', 'a', 'pretty', 'strong', 'launch', 'window', 'especially', 'with', 'thps2', 'mario', 'advance', 'konami', 'krazy', 'racers', 'fzero', 'mv', 'castlevania', 'circle', 'of', 'the', 'moon', 'and', 'chu', 'chu', 'rocket']","['interesting', 'thought', 'gba', 'pretty', 'strong', 'launch', 'window', 'especially', 'thps2', 'mario', 'advance', 'konami', 'krazy', 'racers', 'fzero', 'mv', 'castlevania', 'circle', 'moon', 'chu', 'chu', 'rocket']","['interest', 'think', 'gba', 'pretty', 'strong', 'launch', 'window', 'especially', 'thps2', 'mario', 'advance', 'konami', 'krazy', 'racer', 'fzero', 'mv', 'castlevania', 'circle', 'moon', 'chu', 'chu', 'rocket']",interest think gba pretty strong launch window especially thps2 mario advance konami krazy racer fzero mv castlevania circle moon chu chu rocket
thehadster,Chu chu rocket is that a real thing lol,1,chu chu rocket is that a real thing lol,"['chu', 'chu', 'rocket', 'is', 'that', 'a', 'real', 'thing', 'lol']","['chu', 'chu', 'rocket', 'real', 'thing', 'lol']","['chu', 'chu', 'rocket', 'real', 'thing', 'lol']",chu chu rocket real thing lol
reevestussi,"Yep, it's a fun action puzzle game designed by Sega/Yuji Naka. Was originally a Dreamcast game which was released near launch window and sold pretty well in both Japan and North America.

The GBA port is pretty much identical content wise to the DC version but playing it with a D-Pad is less intuitive than an analog stick",1,"yep its a fun action puzzle game designed by segayuji naka was originally a dreamcast game which was released near launch window and sold pretty well in both japan and north america

the gba port is pretty much identical content wise to the dc version but playing it with a dpad is less intuitive than an analog stick","['yep', 'its', 'a', 'fun', 'action', 'puzzle', 'game', 'designed', 'by', 'segayuji', 'naka', 'was', 'originally', 'a', 'dreamcast', 'game', 'which', 'was', 'released', 'near', 'launch', 'window', 'and', 'sold', 'pretty', 'well', 'in', 'both', 'japan', 'and', 'north', 'america', 'the', 'gba', 'port', 'is', 'pretty', 'much', 'identical', 'content', 'wise', 'to', 'the', 'dc', 'version', 'but', 'playing', 'it', 'with', 'a', 'dpad', 'is', 'less', 'intuitive', 'than', 'an', 'analog', 'stick']","['yep', 'fun', 'action', 'puzzle', 'game', 'designed', 'segayuji', 'naka', 'originally', 'dreamcast', 'game', 'released', 'near', 'launch', 'window', 'sold', 'pretty', 'well', 'japan', 'north', 'america', 'gba', 'port', 'pretty', 'much', 'identical', 'content', 'wise', 'dc', 'version', 'playing', 'dpad', 'less', 'intuitive', 'analog', 'stick']","['yep', 'fun', 'action', 'puzzle', 'game', 'design', 'segayuji', 'naka', 'originally', 'dreamcast', 'game', 'release', 'near', 'launch', 'window', 'sell', 'pretty', 'well', 'japan', 'north', 'america', 'gba', 'port', 'pretty', 'much', 'identical', 'content', 'wise', 'dc', 'version', 'play', 'dpad', 'less', 'intuitive', 'analog', 'stick']",yep fun action puzzle game design segayuji naka originally dreamcast game release near launch window sell pretty well japan north america gba port pretty much identical content wise dc version play dpad less intuitive analog stick
Suspicious-Cress7575,"That's an unrealistic argument you are making. You can have a solid launch on top of the console being a future investment. These two things are not mutually exclusive and no one ever thought to themselves ""I'm buying everything that's offered on day 1 and I'm done with my purchases for the entire lifetime of this console."" There is no reason to buy this console right now unless you are a Kart junkie or just want an excuse to play old games again. I almost always buy consoles at release but I just don't see the reason to have it yet. I will eventually get it when it builds up a bit of a catalog.",2,thats an unrealistic argument you are making you can have a solid launch on top of the console being a future investment these two things are not mutually exclusive and no one ever thought to themselves im buying everything thats offered on day 1 and im done with my purchases for the entire lifetime of this console there is no reason to buy this console right now unless you are a kart junkie or just want an excuse to play old games again i almost always buy consoles at release but i just dont see the reason to have it yet i will eventually get it when it builds up a bit of a catalog,"['thats', 'an', 'unrealistic', 'argument', 'you', 'are', 'making', 'you', 'can', 'have', 'a', 'solid', 'launch', 'on', 'top', 'of', 'the', 'console', 'being', 'a', 'future', 'investment', 'these', 'two', 'things', 'are', 'not', 'mutually', 'exclusive', 'and', 'no', 'one', 'ever', 'thought', 'to', 'themselves', 'im', 'buying', 'everything', 'thats', 'offered', 'on', 'day', '1', 'and', 'im', 'done', 'with', 'my', 'purchases', 'for', 'the', 'entire', 'lifetime', 'of', 'this', 'console', 'there', 'is', 'no', 'reason', 'to', 'buy', 'this', 'console', 'right', 'now', 'unless', 'you', 'are', 'a', 'kart', 'junkie', 'or', 'just', 'want', 'an', 'excuse', 'to', 'play', 'old', 'games', 'again', 'i', 'almost', 'always', 'buy', 'consoles', 'at', 'release', 'but', 'i', 'just', 'dont', 'see', 'the', 'reason', 'to', 'have', 'it', 'yet', 'i', 'will', 'eventually', 'get', 'it', 'when', 'it', 'builds', 'up', 'a', 'bit', 'of', 'a', 'catalog']","['thats', 'unrealistic', 'argument', 'making', 'solid', 'launch', 'top', 'console', 'future', 'investment', 'two', 'things', 'mutually', 'exclusive', 'one', 'ever', 'thought', 'im', 'buying', 'everything', 'thats', 'offered', 'day', '1', 'im', 'done', 'purchases', 'entire', 'lifetime', 'console', 'reason', 'buy', 'console', 'right', 'unless', 'kart', 'junkie', 'want', 'excuse', 'play', 'old', 'games', 'almost', 'always', 'buy', 'consoles', 'release', 'dont', 'see', 'reason', 'yet', 'eventually', 'get', 'builds', 'bit', 'catalog']","['thats', 'unrealistic', 'argument', 'make', 'solid', 'launch', 'top', 'console', 'future', 'investment', 'two', 'thing', 'mutually', 'exclusive', 'one', 'ever', 'think', 'im', 'buying', 'everything', 'thats', 'offer', 'day', '1', 'im', 'do', 'purchase', 'entire', 'lifetime', 'console', 'reason', 'buy', 'console', 'right', 'unless', 'kart', 'junkie', 'want', 'excuse', 'play', 'old', 'game', 'almost', 'always', 'buy', 'console', 'release', 'dont', 'see', 'reason', 'yet', 'eventually', 'get', 'build', 'bit', 'catalog']",thats unrealistic argument make solid launch top console future investment two thing mutually exclusive one ever think im buying everything thats offer day 1 im do purchase entire lifetime console reason buy console right unless kart junkie want excuse play old game almost always buy console release dont see reason yet eventually get build bit catalog
MolotovMan1263,"Aside from the monetary loss, there also isn't a reason NOT to get it now. Price isn't going down anytime soon, it plays every Switch 1 game the same or better, plus the new stuff to play.",1,aside from the monetary loss there also isnt a reason not to get it now price isnt going down anytime soon it plays every switch 1 game the same or better plus the new stuff to play,"['aside', 'from', 'the', 'monetary', 'loss', 'there', 'also', 'isnt', 'a', 'reason', 'not', 'to', 'get', 'it', 'now', 'price', 'isnt', 'going', 'down', 'anytime', 'soon', 'it', 'plays', 'every', 'switch', '1', 'game', 'the', 'same', 'or', 'better', 'plus', 'the', 'new', 'stuff', 'to', 'play']","['aside', 'monetary', 'loss', 'also', 'isnt', 'reason', 'get', 'price', 'isnt', 'going', 'anytime', 'soon', 'plays', 'every', 'switch', '1', 'game', 'better', 'plus', 'new', 'stuff', 'play']","['aside', 'monetary', 'loss', 'also', 'isnt', 'reason', 'get', 'price', 'isnt', 'go', 'anytime', 'soon', 'play', 'every', 'switch', '1', 'game', 'well', 'plus', 'new', 'stuff', 'play']",aside monetary loss also isnt reason get price isnt go anytime soon play every switch 1 game well plus new stuff play
wellillseeyoulater,Do you know if you have to repurchase switch 1 games? I’m debating getting one but I might wait until there’s something in the library I’m excited about. I got a switch 1 immediately because BOTW looked awesome but I’m just not that excited about MKW and I’m not really into those games in general,1,do you know if you have to repurchase switch 1 games im debating getting one but i might wait until theres something in the library im excited about i got a switch 1 immediately because botw looked awesome but im just not that excited about mkw and im not really into those games in general,"['do', 'you', 'know', 'if', 'you', 'have', 'to', 'repurchase', 'switch', '1', 'games', 'im', 'debating', 'getting', 'one', 'but', 'i', 'might', 'wait', 'until', 'theres', 'something', 'in', 'the', 'library', 'im', 'excited', 'about', 'i', 'got', 'a', 'switch', '1', 'immediately', 'because', 'botw', 'looked', 'awesome', 'but', 'im', 'just', 'not', 'that', 'excited', 'about', 'mkw', 'and', 'im', 'not', 'really', 'into', 'those', 'games', 'in', 'general']","['know', 'repurchase', 'switch', '1', 'games', 'im', 'debating', 'getting', 'one', 'might', 'wait', 'theres', 'something', 'library', 'im', 'excited', 'got', 'switch', '1', 'immediately', 'botw', 'looked', 'awesome', 'im', 'excited', 'mkw', 'im', 'really', 'games', 'general']","['know', 'repurchase', 'switch', '1', 'game', 'im', 'debate', 'get', 'one', 'might', 'wait', 'there', 'something', 'library', 'im', 'excite', 'get', 'switch', '1', 'immediately', 'botw', 'look', 'awesome', 'im', 'excite', 'mkw', 'im', 'really', 'game', 'general']",know repurchase switch 1 game im debate get one might wait there something library im excite get switch 1 immediately botw look awesome im excite mkw im really game general
MolotovMan1263,All you Switch 1 games play on Switch 2,3,all you switch 1 games play on switch 2,"['all', 'you', 'switch', '1', 'games', 'play', 'on', 'switch', '2']","['switch', '1', 'games', 'play', 'switch', '2']","['switch', '1', 'game', 'play', 'switch', '2']",switch 1 game play switch 2
[deleted],[deleted],3,deleted,['deleted'],['deleted'],['delete'],delete
nosungdeeptongs,"As someone who never owned a ps4, all the free ps4 games you could get for ps5 were awesome.  Bloodborne was the only one i actually played though lol",2,as someone who never owned a ps4 all the free ps4 games you could get for ps5 were awesome  bloodborne was the only one i actually played though lol,"['as', 'someone', 'who', 'never', 'owned', 'a', 'ps4', 'all', 'the', 'free', 'ps4', 'games', 'you', 'could', 'get', 'for', 'ps5', 'were', 'awesome', 'bloodborne', 'was', 'the', 'only', 'one', 'i', 'actually', 'played', 'though', 'lol']","['someone', 'never', 'owned', 'ps4', 'free', 'ps4', 'games', 'could', 'get', 'ps5', 'awesome', 'bloodborne', 'one', 'actually', 'played', 'though', 'lol']","['someone', 'never', 'own', 'ps4', 'free', 'ps4', 'game', 'could', 'get', 'ps5', 'awesome', 'bloodborne', 'one', 'actually', 'play', 'though', 'lol']",someone never own ps4 free ps4 game could get ps5 awesome bloodborne one actually play though lol
dominustui56,This isn't even Nintendo's worst launch. The Nintendo 64 launched in the US with Super Mario 64 and Pilot Wings 64. Thats it.,6,this isnt even nintendos worst launch the nintendo 64 launched in the us with super mario 64 and pilot wings 64 thats it,"['this', 'isnt', 'even', 'nintendos', 'worst', 'launch', 'the', 'nintendo', '64', 'launched', 'in', 'the', 'us', 'with', 'super', 'mario', '64', 'and', 'pilot', 'wings', '64', 'thats', 'it']","['isnt', 'even', 'nintendos', 'worst', 'launch', 'nintendo', '64', 'launched', 'us', 'super', 'mario', '64', 'pilot', 'wings', '64', 'thats']","['isnt', 'even', 'nintendos', 'bad', 'launch', 'nintendo', '64', 'launch', 'u', 'super', 'mario', '64', 'pilot', 'wing', '64', 'thats']",isnt even nintendos bad launch nintendo 64 launch u super mario 64 pilot wing 64 thats
FunkmasterP,...but Super Mario 64 was a generation-defining masterpiece.,21,but super mario 64 was a generationdefining masterpiece,"['but', 'super', 'mario', '64', 'was', 'a', 'generationdefining', 'masterpiece']","['super', 'mario', '64', 'generationdefining', 'masterpiece']","['super', 'mario', '64', 'generationdefining', 'masterpiece']",super mario 64 generationdefining masterpiece
FloppyDysk,Probably my favorite game ever made,1,probably my favorite game ever made,"['probably', 'my', 'favorite', 'game', 'ever', 'made']","['probably', 'favorite', 'game', 'ever', 'made']","['probably', 'favorite', 'game', 'ever', 'make']",probably favorite game ever make
SmashMouthBreadThrow,Weird comparison considering SM64 is considered to be one of the greatest games of all time lol.,6,weird comparison considering sm64 is considered to be one of the greatest games of all time lol,"['weird', 'comparison', 'considering', 'sm64', 'is', 'considered', 'to', 'be', 'one', 'of', 'the', 'greatest', 'games', 'of', 'all', 'time', 'lol']","['weird', 'comparison', 'considering', 'sm64', 'considered', 'one', 'greatest', 'games', 'time', 'lol']","['weird', 'comparison', 'consider', 'sm64', 'consider', 'one', 'great', 'game', 'time', 'lol']",weird comparison consider sm64 consider one great game time lol
dominustui56,Referring to quantity not quality.,10,referring to quantity not quality,"['referring', 'to', 'quantity', 'not', 'quality']","['referring', 'quantity', 'quality']","['refer', 'quantity', 'quality']",refer quantity quality
Competitive_Dot_8744,Isn’t the new Mario kart supposed to be one of the greatest racing games of all time?,1,isnt the new mario kart supposed to be one of the greatest racing games of all time,"['isnt', 'the', 'new', 'mario', 'kart', 'supposed', 'to', 'be', 'one', 'of', 'the', 'greatest', 'racing', 'games', 'of', 'all', 'time']","['isnt', 'new', 'mario', 'kart', 'supposed', 'one', 'greatest', 'racing', 'games', 'time']","['isnt', 'new', 'mario', 'kart', 'suppose', 'one', 'great', 'race', 'game', 'time']",isnt new mario kart suppose one great race game time
Suspicious-Cress7575,Well Super Mario 64 is a god tier game so that alone lifts up the entire console. The definition of a killer app.,1,well super mario 64 is a god tier game so that alone lifts up the entire console the definition of a killer app,"['well', 'super', 'mario', '64', 'is', 'a', 'god', 'tier', 'game', 'so', 'that', 'alone', 'lifts', 'up', 'the', 'entire', 'console', 'the', 'definition', 'of', 'a', 'killer', 'app']","['well', 'super', 'mario', '64', 'god', 'tier', 'game', 'alone', 'lifts', 'entire', 'console', 'definition', 'killer', 'app']","['well', 'super', 'mario', '64', 'god', 'tier', 'game', 'alone', 'lifts', 'entire', 'console', 'definition', 'killer', 'app']",well super mario 64 god tier game alone lifts entire console definition killer app
SupremelyPerfect,"Haha no, first device i got was the original GameBoy colour!  I'm well used it Nintendo console launches, just had higher expectations given the success of the Switch and how they slowed down 1st party games for awhile on the Switch 1 and the rumours of it being ready for a long time.

Trust me, I'm aware this is league's better than 3DS launch for example! Street Fighter &amp; Steel Diver wasn't my thing",-3,"haha no first device i got was the original gameboy colour  im well used it nintendo console launches just had higher expectations given the success of the switch and how they slowed down 1st party games for awhile on the switch 1 and the rumours of it being ready for a long time

trust me im aware this is leagues better than 3ds launch for example street fighter amp steel diver wasnt my thing","['haha', 'no', 'first', 'device', 'i', 'got', 'was', 'the', 'original', 'gameboy', 'colour', 'im', 'well', 'used', 'it', 'nintendo', 'console', 'launches', 'just', 'had', 'higher', 'expectations', 'given', 'the', 'success', 'of', 'the', 'switch', 'and', 'how', 'they', 'slowed', 'down', '1st', 'party', 'games', 'for', 'awhile', 'on', 'the', 'switch', '1', 'and', 'the', 'rumours', 'of', 'it', 'being', 'ready', 'for', 'a', 'long', 'time', 'trust', 'me', 'im', 'aware', 'this', 'is', 'leagues', 'better', 'than', '3ds', 'launch', 'for', 'example', 'street', 'fighter', 'amp', 'steel', 'diver', 'wasnt', 'my', 'thing']","['haha', 'first', 'device', 'got', 'original', 'gameboy', 'colour', 'im', 'well', 'used', 'nintendo', 'console', 'launches', 'higher', 'expectations', 'given', 'success', 'switch', 'slowed', '1st', 'party', 'games', 'awhile', 'switch', '1', 'rumours', 'ready', 'long', 'time', 'trust', 'im', 'aware', 'leagues', 'better', '3ds', 'launch', 'example', 'street', 'fighter', 'amp', 'steel', 'diver', 'wasnt', 'thing']","['haha', 'first', 'device', 'get', 'original', 'gameboy', 'colour', 'im', 'well', 'use', 'nintendo', 'console', 'launch', 'high', 'expectation', 'give', 'success', 'switch', 'slow', '1st', 'party', 'game', 'awhile', 'switch', '1', 'rumour', 'ready', 'long', 'time', 'trust', 'im', 'aware', 'league', 'well', '3d', 'launch', 'example', 'street', 'fighter', 'amp', 'steel', 'diver', 'wasnt', 'thing']",haha first device get original gameboy colour im well use nintendo console launch high expectation give success switch slow 1st party game awhile switch 1 rumour ready long time trust im aware league well 3d launch example street fighter amp steel diver wasnt thing
